Household Income,Household Size,Census Region,Product Total Price,Connection Speed,Children Present,Domain ID,Basket Total,Machine Identifier,Zip Code,product Quantity,Product Category ID,Date of Activity,Domain Name,Product Name,Racial Background,Most Education -- Head of Household,Site Session ID,Time of Activity,Country of Origin,Oldest Age -- Head of Household
7,4,1,17.99,1,1,4.04667E+18,165.93,97807416,10973,1,23,20120129,amazon.com,ANGEL BEATS ANIME FABRIC WALL SCROLL POSTER (16\\1X21\\1) INCHES N/A,1,99,7.25842E+13,5:41:06,0,11
7,4,1,39.99,1,1,4.04667E+18,165.93,97807416,10973,1,23,20120129,amazon.com,ANGEL BEATS! COMPLETE COLLECTION [BLU-RAY] N/A,1,99,7.25842E+13,5:41:06,0,11
7,5,4,9.49,1,1,4.04667E+18,23.31,97807522,87107,1,23,20120321,amazon.com,FRANCO (2ND EDITION) N/A,1,99,7.83326E+13,0:00:25,0,7
7,5,4,3.13,1,1,4.04667E+18,23.31,97807522,87107,1,23,20120321,amazon.com,FRANCO (LIFE&TIMES) N/A,1,99,7.83326E+13,0:00:25,0,7
1,3,3,0.45,1,1,4.04667E+18,4.44,97813752,38114,1,23,20121112,amazon.com,ACE POKER DESIGN HARD CASE COVER FOR SAMSUNG GALAXY PREVAIL M820 PRECEDENT M828C N/A,2,99,4.59248E+11,0:13:53,0,11
1,3,3,18.69,1,1,4.04667E+18,50.42,97813752,38114,1,23,20120414,amazon.com,FIGHT NIGHT CHAMPION N/A,2,99,7.84282E+13,16:23:45,0,11
5,3,3,3.88,1,1,4.04667E+18,15.86,97814185,27041,1,23,20120815,amazon.com,THE THIRTEENTH TALE N/A,1,99,1.12211E+14,20:54:33,0,7
5,3,3,79.82,1,1,4.04667E+18,79.82,97814185,27041,1,23,20120110,amazon.com,COMPREHENSIVE CURRICULUM FOR GIFTED LEARNERS (3RD EDITION) N/A,1,99,7.33929E+13,21:02:52,0,7
4,2,2,19.99,1,1,4.04667E+18,32.97,97815767,55435,1,23,20120515,amazon.com,THE LONE RANGER 75TH ANNIVERSARY - SEASONS 1 AND 2 N/A,1,99,8.00294E+13,2:24:37,0,11
1,2,4,21.75,1,0,4.04667E+18,25.74,97923464,92545,1,23,20121030,amazon.com,"FIFTY SHADES TRILOGY FIFTY SHADES OF GREY, FIFTY SHADES DARKER, FIFTY SHADES FREED 3-VOLUME BOXED SET N/A",1,99,4.7875E+11,15:42:09,0,10
7,2,1,157.54,1,1,4.04667E+18,163.02,97924369,19107,1,23,20121218,amazon.com,"B. MAKOWSKY GOODWIN SATCHEL,CRIMSON,ONE SIZE N/A",1,99,3.91957E+11,0:01:51,0,4
5,2,2,8.5,1,1,4.04667E+18,12.98,97924463,67203,1,23,20120503,amazon.com,THE COLOR PURPLE ALICE WALKER  KINDLE STORE N/A,1,99,7.92578E+13,22:15:49,0,9
4,4,3,4.99,1,1,4.04667E+18,24.53,97928116,22192,1,23,20121201,amazon.com,TOY STORY 2 N/A,5,99,3.94831E+11,21:29:27,0,2
3,2,2,23.95,1,0,4.04667E+18,63.56,97929374,61282,1,23,20120905,amazon.com,SHERLOCK SEASON ONE N/A,1,99,5.56287E+11,0:28:46,0,10
3,2,2,23.69,1,0,4.04667E+18,63.56,97929374,61282,1,23,20120905,amazon.com,DIE HARD N/A,1,99,5.56287E+11,0:28:46,0,10
3,2,2,11.93,1,0,4.04667E+18,63.56,97929374,61282,1,23,20120905,amazon.com,BEACH BLANKET BINGO / HOW TO STUFF A WILD BIKINI (MIDNITE MOVIES DOUBLE FEATURE) N/A,1,99,5.56287E+11,0:28:46,0,10
3,2,2,25.99,1,0,4.04667E+18,50.98,97929374,61282,1,23,20120216,amazon.com,DOCTOR WHO DAY OF THE DALEKS - EPISODE 60 N/A,1,99,7.60591E+13,2:33:17,0,10
1,1,2,5,1,0,4.04667E+18,18.97,97929800,60640,1,23,20120605,amazon.com,SOMETHING REAL [VINYL] N/A,1,99,1.03688E+14,8:17:17,0,4
1,1,2,5.55,1,0,4.04667E+18,8.53,97929800,60640,1,23,20120418,amazon.com,TANTALIZINGLY HOT LP N/A,1,99,8.06047E+13,8:42:43,0,4
7,3,1,41.7,1,0,4.04667E+18,41.7,97930355,7728,1,23,20120212,amazon.com,ESSCHERT DESIGN WHITE WINDOW FRAME W/FRENCH DOORS N/A,1,99,7.58651E+13,23:36:59,0,8
5,2,2,12.99,1,0,4.04667E+18,17.47,97930747,48473,1,23,20121203,amazon.com,THE THIRD BULLET (BOB LEE SWAGGER) STEPHEN HUNTER  KINDLE STORE N/A,1,99,4.17151E+11,0:01:16,0,11
5,2,2,20.58,1,0,4.04667E+18,186.19,97930747,48473,1,23,20121111,amazon.com,NCSTAR 1\\1 WEAVER RING-SILVER (RS01) N/A,1,99,4.29465E+11,2:49:30,0,11
5,2,2,25.6,1,0,4.04667E+18,32.59,97930747,48473,1,23,20120902,amazon.com,THE GODFATHER OF GRAPPLING N/A,1,99,4.93104E+11,1:27:38,0,11
5,2,2,20.49,1,0,4.04667E+18,27.48,97930747,48473,1,23,20120714,amazon.com,THE GODFATHER OF GRAPPLING N/A,1,99,9.98078E+13,22:44:38,0,11
7,3,4,2.99,1,1,4.04667E+18,42.39,97933623,92130,1,23,20120102,amazon.com,(22X34) SELENA GOMEZ WIZARDS OF WAVERLY PLACE TELEVISION POSTER N/A,1,99,7.22272E+13,16:55:25,0,6
6,5,2,0.08,1,1,4.04667E+18,12.01,97970147,45807,1,23,20120103,amazon.com,"CLOCKWORK ORANGE MOVIE (SUBWAY SILHOUETTE) POSTER PRINT - 24X36 POSTER PRINT, 36X24 POSTER PRINT, 36X24 COLLECTIONS POSTER PRINT, 36X24 N/A",1,99,7.26477E+13,20:58:08,0,6
6,5,2,2.99,1,1,4.04667E+18,12.01,97970147,45807,1,23,20120103,amazon.com,CHICAGO POSTER CITY SKYLINE DUSK PHOTO ART 23X35 8795 N/A,1,99,7.26477E+13,20:58:08,0,6
4,5,3,15,1,1,4.04667E+18,72.8,97970503,29223,1,23,20121203,amazon.com,RADICAL LOVING CARE BUILDING THE HEALING HOSPITAL IN AMERICA N/A,1,99,4.17505E+11,1:00:19,0,8
7,4,3,74.98,1,1,4.04667E+18,110.9,97970871,22192,2,23,20121206,amazon.com,THE CAROL BURNETT SHOW CAROL'S FAVORITES (COLLECTORS EDITION) N/A,1,99,4.0716E+11,15:09:40,0,8
7,4,3,17,1,1,4.04667E+18,110.9,97970871,22192,1,23,20121206,amazon.com,WHERE THE YELLOWSTONE GOES N/A,1,99,4.0716E+11,15:09:40,0,8
3,1,3,11.63,1,0,4.04667E+18,111.82,97974871,33602,1,23,20120831,amazon.com,NOW - HORNY GOAT WEED EXTRACT 750MG - 90 TABS N/A,1,99,1.12882E+14,23:23:33,1,3
3,1,3,39.5,1,0,4.04667E+18,111.82,97974871,33602,1,23,20120831,amazon.com,"JACO RESURGENCE MMA MEN'S FIGHT SHORTS, 34, BK N/A",1,99,1.12882E+14,23:23:33,1,3
3,1,3,13.42,1,0,4.04667E+18,37.79,97974871,33602,1,23,20121020,amazon.com,"DOC JOHNSON LUCID DREAM 14 MULTI-SPEED, WATERPROOF G-SPOT VIBRATOR, TWIST-BOTTOM CONTROL, PURPLE N/A",1,99,4.41996E+11,5:31:28,1,3
2,3,4,13.19,1,1,4.04667E+18,38.67,97977823,88310,1,23,20120309,amazon.com,"23\\1X15\\1 DR. SEUSS WE ARE ALL A LITTLE WEIRD AND LIFE'S A LITTLE WEIRD, AND WHEN WE FIND SOMEONE WHOSE WEIRDNESS IS COMPATIBLE WITH OURS, WE JOIN UP WITH THEM AND FALL IN MUTUAL WEIRDNESS AND CALL N/A",1,99,7.58755E+13,4:15:38,0,4
2,3,4,29.99,1,1,4.04667E+18,63.77,97977823,88310,1,23,20120430,amazon.com,THE HUNGER GAMES TRILOGY BOXED SET N/A,1,99,7.83552E+13,3:14:36,0,4
7,3,3,23.99,1,0,4.04667E+18,40.48,97978431,37180,1,23,20121204,amazon.com,DOWNTON ABBEY SEASONS 1 & 2 LIMITED EDITION SET - ORIGINAL UK VERSION N/A,1,99,4.24604E+11,2:10:20,0,10
1,2,3,7.19,1,1,4.04667E+18,11.18,98013109,75216,1,23,20120530,amazon.com,OUTWITTING THE DEVIL N/A,2,99,8.05418E+13,16:33:23,0,11
2,3,3,5,1,1,4.04667E+18,70.34,98013714,70525,1,23,20120114,amazon.com,REESE (ROCK CREEK SIX) N/A,1,99,7.31576E+13,3:06:17,0,10
7,4,3,7.99,1,1,4.04667E+18,12.47,98015376,38017,1,23,20121201,amazon.com,OUTLAW (CARRE) SUSAN JOHNSON  KINDLE STORE N/A,1,99,4.05429E+11,20:56:03,0,11
7,4,3,2.99,1,1,4.04667E+18,7.47,98015376,38017,1,23,20121201,amazon.com,MOVE ME (HIDDEN) EMMA HOLLY  KINDLE STORE N/A,1,99,4.05429E+11,20:56:03,0,11
7,4,3,1.99,1,1,4.04667E+18,6.47,98015376,38017,1,23,20121207,amazon.com,"WILD WILD WIDOW, A WESTERN ROMANCE EMMA JAY  KINDLE STORE N/A",1,99,4.10683E+11,6:20:48,0,11
7,4,3,0.99,1,1,4.04667E+18,5.47,98015376,38017,1,23,20121212,amazon.com,TEXAS REIN BECKY RODGERS BOYETTE  KINDLE STORE N/A,1,99,4.20117E+11,1:15:15,0,11
7,4,3,0.99,1,1,4.04667E+18,5.47,98015376,38017,1,23,20121212,amazon.com,RAWHIDE AND ROSES MADDIE JAMES  KINDLE STORE N/A,1,99,4.20117E+11,1:15:15,0,11
7,4,3,41.86,1,1,4.04667E+18,153.26,98015376,38017,2,23,20121129,amazon.com,"MOZART VIOLIN SONATAS - GIL SHAHAM, ORLI SHAHAM [REGION 0] N/A",1,99,4.31823E+11,0:00:11,0,11
7,4,3,14.9,1,1,4.04667E+18,153.26,98015376,38017,1,23,20121129,amazon.com,DISCOVERING MASTERPIECES OF CLASSICAL MUSIC MENDELSSOHN'S VIOLIN CONCERTO IN E MINOR [DVD VIDEO] N/A,1,99,4.31823E+11,0:00:11,0,11
7,4,3,2.99,1,1,4.04667E+18,7.47,98015376,38017,1,23,20121203,amazon.com,TAKEN BY PIRATES (AN EROTIC PIRATE ADVENTURE) VIRGINIA WADE  KINDLE STORE N/A,1,99,4.37543E+11,18:43:20,0,11
7,4,3,3.99,1,1,4.04667E+18,8.47,98015376,38017,1,23,20121203,amazon.com,SARAH'S PLAYMATES (A WILD WEST EROTIC ADVENTURE) VIRGINIA WADE  KINDLE STORE N/A,1,99,4.37543E+11,18:43:20,0,11
7,4,3,29.99,1,1,4.04667E+18,49.94,98015376,38017,1,23,20120926,amazon.com,THE OBAMA DECEPTION THE MASK COMES OFF N/A,1,99,5.38877E+11,22:12:49,0,11
7,4,3,8.48,1,1,4.04667E+18,51.5,98015376,38017,1,23,20120517,amazon.com,PRACTICE MAKES PERFECT SPANISH CONVERSATION (PRACTICE MAKES PERFECT SERIES) N/A,1,99,7.869E+13,0:08:40,0,11
7,2,2,15.98,1,1,4.04667E+18,56.74,98022692,60110,1,23,20120728,amazon.com,"MY FIRST LEAPPAD LEAP TO THE MOON, JAY JAY HIGH FLYING ADVENTURES, & THOMAS AND THE SCHOOL TRIP 3 PACK N/A",1,99,1.00265E+14,3:24:22,0,3
7,2,2,10.48,1,1,4.04667E+18,25.88,98022692,60110,1,23,20120813,amazon.com,"LEAP PAD \\1MY FIRST LEAP PAD\\1 SYSTEM - COMES WITH UNIT, CARTRIDGE, BOOK, AND BATTERIES - EXCELLENT CONDITION N/A",1,99,1.122E+14,4:33:09,0,3
7,2,2,1.27,1,1,4.04667E+18,11.72,98022692,60110,1,23,20120902,amazon.com,HELLO KITTY NERD STICKER DECAL. PINK N/A,1,99,5.25513E+11,21:31:57,0,3
5,5,4,11.49,1,0,4.04667E+18,60.92,98026292,98506,1,23,20121128,amazon.com,IN TIME N/A,1,99,4.33888E+11,12:42:23,0,11
5,5,4,118,1,0,4.04667E+18,123.97,98026292,98506,2,23,20121027,amazon.com,HALO 4 ($10 AMAZON INSTANT VIDEO CREDIT AND EXCLUSIVE PRE-ORDER BONUS) N/A,1,99,4.52739E+11,2:15:58,0,11
5,5,4,3.79,1,0,4.04667E+18,34.56,98026292,98506,1,23,20121016,amazon.com,NFL SUPER BOWL XLIII PITTSBURGH STEELERS CHAMPIONS DVD N/A,1,99,5.04064E+11,1:08:16,0,11
5,5,4,26.31,1,0,4.04667E+18,80.16,98026292,98506,1,23,20121001,amazon.com,PLANET OF THE APES THE LEGACY COLLECTION (PLANET OF THE APES / BENEATH THE / ESCAPE FROM THE / CONQUEST OF THE / BATTLE FOR THE) N/A,1,99,5.35235E+11,20:38:24,0,11
5,5,4,2.89,1,0,4.04667E+18,80.16,98026292,98506,1,23,20121001,amazon.com,PLANET OF THE APES N/A,1,99,5.35235E+11,20:38:24,0,11
5,5,4,2.99,1,0,4.04667E+18,141.64,98026292,98506,1,23,20120220,amazon.com,STAR WARS EPISODE II - ATTACK OF THE CLONES (WIDESCREEN EDITION) N/A,1,99,7.5233E+13,18:05:48,0,11
5,5,4,16.99,1,0,4.04667E+18,40.53,98026292,98506,1,23,20120507,amazon.com,UNDERWORLD AWAKENING N/A,1,99,8.03073E+13,14:57:17,0,11
5,5,4,38.5,1,0,4.04667E+18,108.5,98026292,98506,1,23,20120418,amazon.com,THE LORD OF THE RINGS THE MOTION PICTURE TRILOGY (SPECIAL EXTENDED EDITION) N/A,1,99,8.06124E+13,2:39:11,0,11
5,5,4,6.14,1,0,4.04667E+18,108.5,98026292,98506,1,23,20120418,amazon.com,FALLOUT NEW VEGAS N/A,1,99,8.06124E+13,2:39:11,0,11
5,5,4,8.35,1,0,4.04667E+18,61.6,98026292,98506,1,23,20120602,amazon.com,RISE OF THE PLANET OF THE APES N/A,1,99,9.53681E+13,2:47:15,0,11
6,3,2,29.94,1,1,4.04667E+18,49.92,98028964,60615,1,23,20120815,amazon.com,LEGO THE LORD OF THE RINGS HOBBIT URAK-HAI ARMY (9471) N/A,3,99,1.12228E+14,16:53:48,0,9
3,2,4,8.51,1,1,4.04667E+18,12.5,98029134,84501,1,23,20121015,amazon.com,HE TOOK MY LICKIN' FOR ME A CLASSIC FOLK TALE N/A,1,99,5.03002E+11,1:18:28,0,11
5,3,4,5,1,1,4.04667E+18,112.05,98030103,90706,1,23,20120131,amazon.com,ROMY AND MICHELE'S HIGH SCHOOL REUNION N/A,1,99,7.41122E+13,1:24:55,0,5
5,3,4,4.49,1,1,4.04667E+18,112.05,98030103,90706,1,23,20120131,amazon.com,FORREST GUMP (TWO-DISC SPECIAL COLLECTOR'S EDITION) N/A,1,99,7.41122E+13,1:24:55,0,5
5,3,4,2.96,1,1,4.04667E+18,112.05,98030103,90706,1,23,20120131,amazon.com,CHAPPELLE'S SHOW - SEASON 2 N/A,1,99,7.41122E+13,1:24:55,0,5
5,3,4,2.98,1,1,4.04667E+18,112.05,98030103,90706,1,23,20120131,amazon.com,THE ADJUSTMENT BUREAU N/A,1,99,7.41122E+13,1:24:55,0,5
5,3,4,3.99,1,1,4.04667E+18,112.05,98030103,90706,1,23,20120131,amazon.com,GOODFELLAS N/A,1,99,7.41122E+13,1:24:55,0,5
5,3,4,2.1,1,1,4.04667E+18,112.05,98030103,90706,1,23,20120131,amazon.com,EDDIE MURPHY - DELIRIOUS N/A,1,99,7.41122E+13,1:24:55,0,5
5,3,4,6.45,1,1,4.04667E+18,112.05,98030103,90706,1,23,20120131,amazon.com,DON KING - ONLY IN AMERICA N/A,1,99,7.41122E+13,1:24:55,0,5
5,3,4,2.88,1,1,4.04667E+18,112.05,98030103,90706,1,23,20120131,amazon.com,BENNY HILL BEST OF BENNY HILL N/A,1,99,7.41122E+13,1:24:55,0,5
5,3,4,0.99,1,1,4.04667E+18,112.05,98030103,90706,1,23,20120131,amazon.com,RESIDENT EVIL - APOCALYPSE (SPECIAL EDITION) N/A,1,99,7.41122E+13,1:24:55,0,5
5,3,4,1.99,1,1,4.04667E+18,112.05,98030103,90706,1,23,20120131,amazon.com,GLADIATOR (SINGLE-DISC WIDESCREEN EDITION) N/A,1,99,7.41122E+13,1:24:55,0,5
5,3,4,0.94,1,1,4.04667E+18,112.05,98030103,90706,1,23,20120131,amazon.com,BLACK HAWK DOWN N/A,1,99,7.41122E+13,1:24:55,0,5
5,3,4,1.5,1,1,4.04667E+18,112.05,98030103,90706,1,23,20120131,amazon.com,BLOW N/A,1,99,7.41122E+13,1:24:55,0,5
5,3,4,1.6,1,1,4.04667E+18,38.8,98030103,90706,1,23,20120228,amazon.com,GAME OF DEATH N/A,1,99,7.51895E+13,17:55:39,0,5
5,3,4,2.88,1,1,4.04667E+18,38.8,98030103,90706,1,23,20120228,amazon.com,BOOMERANG N/A,1,99,7.51895E+13,17:55:39,0,5
5,3,4,2.59,1,1,4.04667E+18,38.8,98030103,90706,1,23,20120228,amazon.com,FORREST GUMP (TWO-DISC SPECIAL COLLECTOR'S EDITION) N/A,1,99,7.51895E+13,17:55:39,0,5
5,3,4,9.74,1,1,4.04667E+18,38.8,98030103,90706,2,23,20120228,amazon.com,PULP FICTION (TWO-DISC COLLECTOR'S EDITION) N/A,1,99,7.51895E+13,17:55:39,0,5
5,3,4,1.49,1,1,4.04667E+18,38.8,98030103,90706,1,23,20120228,amazon.com,FIST OF LEGEND N/A,1,99,7.51895E+13,17:55:39,0,5
5,3,4,1.63,1,1,4.04667E+18,38.8,98030103,90706,1,23,20120228,amazon.com,BLOW N/A,1,99,7.51895E+13,17:55:39,0,5
5,3,4,0.24,1,1,4.04667E+18,45.88,98030103,90706,1,23,20120518,amazon.com,JURASSIC PARK III (WIDESCREEN COLLECTOR'S EDITION) N/A,1,99,7.68861E+13,4:24:19,0,5
5,3,4,1.55,1,1,4.04667E+18,45.88,98030103,90706,1,23,20120518,amazon.com,EDDIE MURPHY - DELIRIOUS N/A,1,99,7.68861E+13,4:24:19,0,5
5,3,4,0.01,1,1,4.04667E+18,45.88,98030103,90706,1,23,20120518,amazon.com,STREET KINGS N/A,1,99,7.68861E+13,4:24:19,0,5
5,3,4,2.59,1,1,4.04667E+18,45.88,98030103,90706,1,23,20120518,amazon.com,SOUL FOOD N/A,1,99,7.68861E+13,4:24:19,0,5
5,3,4,0.99,1,1,4.04667E+18,45.88,98030103,90706,1,23,20120518,amazon.com,AMERICAN GANGSTER (2-DISC UNRATED EXTENDED EDITION) N/A,1,99,7.68861E+13,4:24:19,0,5
5,3,4,2.13,1,1,4.04667E+18,45.88,98030103,90706,1,23,20120518,amazon.com,SET IT OFF (SNAP CASE) N/A,1,99,7.68861E+13,4:24:19,0,5
5,3,4,2.89,1,1,4.04667E+18,45.88,98030103,90706,1,23,20120518,amazon.com,MENACE II SOCIETY N/A,1,99,7.68861E+13,4:24:19,0,5
5,3,4,1.29,1,1,4.04667E+18,45.88,98030103,90706,1,23,20120518,amazon.com,"GRINDHOUSE PRESENTS, PLANET TERROR - EXTENDED AND UNRATED (TWO-DISC SPECIAL EDITION) N/A",1,99,7.68861E+13,4:24:19,0,5
5,3,4,2.84,1,1,4.04667E+18,26.56,98030103,90706,1,23,20120320,amazon.com,MR. & MRS. SMITH / TRUE LIES (DOUBLE FEATURE) N/A,1,99,7.849E+13,7:36:59,0,5
5,3,4,1,1,1,4.04667E+18,26.56,98030103,90706,1,23,20120320,amazon.com,HANCOCK (SINGLE-DISC UNRATED EDITION) N/A,1,99,7.849E+13,7:36:59,0,5
5,3,4,0.99,1,1,4.04667E+18,26.56,98030103,90706,1,23,20120320,amazon.com,PRIVATE PARTS N/A,1,99,7.849E+13,7:36:59,0,5
5,3,4,3.48,1,1,4.04667E+18,26.56,98030103,90706,1,23,20120320,amazon.com,DEAD PRESIDENTS N/A,1,99,7.849E+13,7:36:59,0,5
5,3,4,0.36,1,1,4.04667E+18,26.56,98030103,90706,1,23,20120320,amazon.com,SWINGERS (MIRAMAX COLLECTOR'S SERIES) N/A,1,99,7.849E+13,7:36:59,0,5
5,3,4,0.01,1,1,4.04667E+18,32.1,98030103,90706,1,23,20120416,amazon.com,HOLLYWOODLAND (WIDESCREEN EDITION) N/A,1,99,8.061E+13,21:03:10,0,5
5,3,4,3.44,1,1,4.04667E+18,32.1,98030103,90706,1,23,20120416,amazon.com,JURASSIC PARK (WIDESCREEN COLLECTOR'S EDITION) N/A,1,99,8.061E+13,21:03:10,0,5
5,3,4,1.59,1,1,4.04667E+18,32.1,98030103,90706,1,23,20120416,amazon.com,THE RUNNING MAN N/A,1,99,8.061E+13,21:03:10,0,5
5,3,4,0.99,1,1,4.04667E+18,32.1,98030103,90706,1,23,20120416,amazon.com,BOAT TRIP (UNRATED EDITION) N/A,1,99,8.061E+13,21:03:10,0,5
5,3,4,0.01,1,1,4.04667E+18,11.94,98030103,90706,1,23,20120410,amazon.com,AUSTIN POWERS INTERNATIONAL MAN OF MYSTERY N/A,1,99,8.23237E+13,3:20:33,0,5
5,3,4,0.99,1,1,4.04667E+18,11.94,98030103,90706,1,23,20120410,amazon.com,TOTAL RECALL N/A,1,99,8.23237E+13,3:20:33,0,5
5,3,4,2,1,1,4.04667E+18,11.94,98030103,90706,1,23,20120410,amazon.com,SCARFACE (WIDESCREEN TWO-DISC ANNIVERSARY EDITION) N/A,1,99,8.23237E+13,3:20:33,0,5
3,2,2,10.94,1,1,4.04667E+18,25.25,98062174,68506,1,23,20120805,amazon.com,BAMBI II (TWO-DISC SPECIAL EDITION BLU-RAY / DVD COMBO IN BLU-RAY PACKAGING) N/A,1,99,1.01581E+14,16:39:41,0,9
3,2,2,1.02,1,1,4.04667E+18,6.21,98062174,68506,1,23,20120825,amazon.com,ROCK N' ROLL HIGH SCHOOL N/A,1,99,1.06737E+14,22:13:00,0,9
3,2,2,9.05,1,1,4.04667E+18,16.04,98062174,68506,1,23,20120825,amazon.com,"DAREDEVIL, VOL. 1 YELLOW N/A",1,99,1.06737E+14,15:39:04,0,9
3,2,2,1.79,1,1,4.04667E+18,20.26,98062174,68506,1,23,20120808,amazon.com,DISNEY'S ART OF ANIMATION FROM MICKEY MOUSE TO BEAUTY AND THE BEAST N/A,1,99,1.10034E+14,23:11:48,0,9
3,2,2,64.99,1,1,4.04667E+18,71.48,98062174,68506,1,23,20120718,amazon.com,DISNEY POP! VINYL #20 - BOO N/A,1,99,1.10706E+14,2:34:48,0,9
3,2,2,10.23,1,1,4.04667E+18,20.52,98062174,68506,1,23,20120831,amazon.com,FUNKO POP STAR WARS (BOBBLE) JAWA N/A,1,99,1.12922E+14,13:08:05,0,9
3,2,2,19.99,1,1,4.04667E+18,27.97,98062174,68506,1,23,20121123,amazon.com,THE SOUND OF MUSIC (45TH ANNIVERSARY BLU-RAY/DVD COMBO LIMITED EDITION) N/A,1,99,4.157E+11,19:10:08,0,9
3,2,2,6.43,1,1,4.04667E+18,9.41,98062174,68506,1,23,20121205,amazon.com,TEN INCH HERO N/A,1,99,4.30715E+11,18:45:22,0,9
3,2,2,6.14,1,1,4.04667E+18,22.6,98062174,68506,1,23,20121023,amazon.com,HEAVY HEAVY MONSTER SOUND- TROJAN RECORDS STORY N/A,1,99,4.99768E+11,16:28:28,0,9
3,2,2,23.99,1,1,4.04667E+18,102.94,98062174,68506,1,23,20120105,amazon.com,THE GUARD [BLU-RAY] N/A,1,99,7.17634E+13,8:08:39,0,9
3,2,2,14.49,1,1,4.04667E+18,102.94,98062174,68506,1,23,20120105,amazon.com,ALIEN [BLU-RAY] N/A,1,99,7.17634E+13,8:08:39,0,9
3,2,2,12.99,1,1,4.04667E+18,102.94,98062174,68506,1,23,20120105,amazon.com,THE PRINCESS BRIDE (TWO-DISC BLU-RAY/DVD COMBO IN BLU-RAY PACKAGING) N/A,1,99,7.17634E+13,8:08:39,0,9
3,2,2,19.85,1,1,4.04667E+18,25.04,98062174,68506,1,23,20120722,amazon.com,ALICE IN WONDERLAND (TWO-DISC 60TH ANNIVERSARY BLU-RAY/DVD COMBO) N/A,1,99,9.97309E+13,22:16:39,0,9
7,2,2,33.19,1,1,4.04667E+18,92.59,98067834,47725,1,23,20120327,amazon.com,FACELESS KILLERS (KURT WALLANDER MYSTERIES) N/A,1,99,7.79338E+13,15:06:43,0,11
7,2,2,23.07,1,1,4.04667E+18,92.59,98067834,47725,1,23,20120327,amazon.com,THE WHITE LIONESS (KURT WALLANDER MYSTERIES) N/A,1,99,7.79338E+13,15:06:43,0,11
4,3,2,83.92,1,1,4.04667E+18,113.91,98068520,43068,1,23,20121126,amazon.com,NIKE KIDS GRADE SCHOOL AIR SPEED TURF (GS) WHITE BLACK RED 535735-100 7 N/A,2,99,4.53323E+11,3:49:44,0,5
1,1,3,17.85,1,0,4.04667E+18,23.04,98074818,29730,1,23,20120223,amazon.com,"FAMILY GUY, VOLUME EIGHT N/A",2,99,7.54782E+13,15:21:06,0,7
1,1,3,11.89,1,0,4.04667E+18,14.87,98074818,29730,1,23,20120404,amazon.com,THE LION KING (TWO-DISC PLATINUM EDITION) N/A,2,99,8.01006E+13,1:39:12,0,7
6,5,2,3.54,1,1,4.04667E+18,31.09,98089116,52501,1,23,20120207,amazon.com,UNDERWORLD AWAKENING POSTER - 2012 MOVIE PROMO FLYER (11 X 17 INCHES) - KATE BECKINSALE 2GTEASER N/A,1,99,7.51352E+13,2:03:31,0,7
6,5,2,1.65,1,1,4.04667E+18,31.09,98089116,52501,1,23,20120207,amazon.com,(22X34) WIZ KHALIFA TATS TATTOOS MUSIC POSTER PRINT N/A,1,99,7.51352E+13,2:03:31,0,7
6,5,2,3.99,1,1,4.04667E+18,14.49,98089116,52501,1,23,20120207,amazon.com,SOUTH PARK - TV SHOW POSTER COLLAGE N/A,1,99,7.51352E+13,2:03:31,0,7
5,4,1,12.17,1,1,4.04667E+18,20.15,98122589,2191,1,23,20120917,amazon.com,AFTER THE FALL N/A,1,99,6.16703E+11,19:31:00,0,9
5,5,4,4.48,1,1,4.04667E+18,27.5,98123058,92660,1,23,20120713,amazon.com,THE LAW N/A,2,99,1.06404E+14,5:34:02,0,6
7,2,3,27.55,1,1,4.04667E+18,85.28,98124460,75061,1,23,20120816,amazon.com,LOUNGEFLY HELLO KITTY LEOPARD EMBOSSED WALLET (LEOPARD) N/A,1,99,1.1152E+14,17:04:14,0,9
5,4,2,59.9,1,1,4.04667E+18,378.89,98126553,47553,1,23,20120513,amazon.com,"THE PERFECT CAMPFIREGRILL NEW ORIGINAL GRILL, 20-INCH BY 25-INCH N/A",1,99,7.68232E+13,19:20:09,0,5
6,3,1,2.02,1,1,4.04667E+18,6.5,98127900,6339,1,23,20121125,amazon.com,THE GREAT SANTINI PAT CONROY  KINDLE STORE N/A,5,99,4.32431E+11,23:30:11,0,11
6,3,1,0.99,1,1,4.04667E+18,5.47,98127900,6339,1,23,20121105,amazon.com,TWISTED PERCEPTION A DETECTIVE ELLIOT MYSTERY BOB AVEY  KINDLE STORE N/A,5,99,4.67064E+11,9:40:13,0,11
6,3,1,20.99,1,1,4.04667E+18,69.24,98127900,6339,1,23,20120223,amazon.com,WAR HORSE (2011) N/A,5,99,7.54524E+13,2:09:38,0,11
4,2,3,2.62,1,0,4.04667E+18,5.6,98131602,27406,1,23,20120328,amazon.com,PATCH ADAMS - COLLECTOR'S EDITION N/A,1,99,7.7622E+13,7:59:12,0,2
7,4,3,11.32,1,0,4.04667E+18,15.31,98135751,22903,1,23,20120719,amazon.com,THE END OF GROWTH ADAPTING TO OUR NEW ECONOMIC REALITY N/A,1,99,1.10015E+14,16:02:19,0,5
7,4,3,5.97,1,0,4.04667E+18,9.96,98135751,22903,1,23,20121025,amazon.com,"C2G / CABLES TO GO 40448 VALUE SERIES RCA TYPE AUDIO VIDEO CABLE-6 FEET, BLACK N/A",1,99,4.94045E+11,19:15:06,0,5
7,4,3,7.99,1,0,4.04667E+18,41.5,98135751,22903,1,23,20120202,amazon.com,MILLIONS OF CATS (GIFT EDITION) (PICTURE PUFFIN BOOKS) N/A,1,99,7.49599E+13,1:52:57,0,5
7,4,3,4.99,1,0,4.04667E+18,22.87,98135751,22903,1,23,20120502,amazon.com,OCEAN FAIRIES #1 ALLY THE DOLPHIN FAIRY A RAINBOW MAGIC BOOK N/A,1,99,7.92175E+13,14:28:41,0,5
7,4,3,136.04,1,0,4.04667E+18,305.28,98135751,22903,1,23,20120411,amazon.com,THOMAS AND FRIENDS WOODEN RAILWAY - QUARRY ADVENTURES SET N/A,1,99,8.22824E+13,17:37:49,0,5
7,4,3,18.49,1,0,4.04667E+18,305.28,98135751,22903,1,23,20120411,amazon.com,THOMAS AND FRIENDS WOODEN RAILWAY - BATTERY POWERED JAMES N/A,1,99,8.22824E+13,17:37:49,0,5
7,4,3,17.77,1,0,4.04667E+18,305.28,98135751,22903,1,23,20120411,amazon.com,THOMAS AND FRIENDS WOODEN RAILWAY - BATTERY OPERATED ROSIE N/A,1,99,8.22824E+13,17:37:49,0,5
7,3,4,10.05,1,0,4.04667E+18,18.03,98136258,97202,1,23,20120630,amazon.com,COPS 20TH ANNIVERSARY EDITION N/A,1,99,9.30491E+13,2:20:17,0,11
5,2,4,10.33,1,1,4.04667E+18,18.31,98138940,98512,1,23,20120729,amazon.com,PIRATES OF THE CARIBBEAN THE CURSE OF THE BLACK PEARL (TWO-DISC COLLECTOR'S EDITION) N/A,1,99,1.00771E+14,17:09:29,0,10
2,2,3,66.84,1,0,4.04667E+18,242.97,98176312,33613,1,23,20120202,amazon.com,"ACQUA DI GIOA BY GIORGIO ARMANI EAU-DE-PARFUME SPRAY, 3.4-OUNCE N/A",2,99,7.49193E+13,2:08:15,0,5
2,2,3,67.49,1,0,4.04667E+18,67.49,98176312,33613,1,23,20120518,amazon.com,ART OF APPRECIATION GIFT BASKETS ESSENCE OF LUXURY SPA BATH AND BODY SET N/A,2,99,7.68891E+13,10:18:58,0,5
6,2,4,22.27,1,1,4.04667E+18,57.2,98176952,98221,1,23,20120427,amazon.com,EL CARTEL NEGRO / THE BLACK CARTEL COMO EL CRIMEN ORGANIZADO SE HA APODERADO DE PEMEX / HOW ORGANIZED CRIME OWNS PEMEX (SPANISH EDITION) N/A,1,99,7.73517E+13,18:09:31,0,9
7,3,2,27.48,1,1,4.04667E+18,51.42,98178118,49279,6,23,20120923,amazon.com,SONY MDW80PL 80 MINUTE MINIDISC MD PREMIUM GOLD (SINGLE) N/A,1,99,5.65803E+11,13:24:36,0,1
5,3,4,6.24,1,1,4.04667E+18,103.7,98184713,81648,1,23,20120729,amazon.com,SUPER TROOPERS N/A,1,99,1.00779E+14,0:00:13,0,8
5,3,4,9.79,1,1,4.04667E+18,103.7,98184713,81648,1,23,20120729,amazon.com,BARNEY'S NUMEROS! NUMEROS! N/A,1,99,1.00779E+14,0:00:13,0,8
5,3,4,11.08,1,1,4.04667E+18,103.7,98184713,81648,1,23,20120729,amazon.com,FISHER PRICE CANTEMOS EN ESPANOL N/A,1,99,1.00779E+14,0:00:13,0,8
5,3,4,2.49,1,1,4.04667E+18,7.68,98184713,81648,1,23,20120430,amazon.com,SHARK TALE (WIDESCREEN EDITION) N/A,1,99,7.83933E+13,22:49:29,0,8
5,3,4,1.14,1,1,4.04667E+18,6.33,98184713,81648,1,23,20120426,amazon.com,OVER THE HEDGE (FULL SCREEN EDITION) N/A,1,99,7.90886E+13,17:10:29,0,8
1,5,4,10.95,1,1,4.04667E+18,36.66,98185662,99016,1,23,20120927,amazon.com,ELLA FITZGERALD'S CHRISTMAS ALBUM N/A,1,99,5.43158E+11,6:31:34,0,9
1,5,4,19.75,1,1,4.04667E+18,36.66,98185662,99016,1,23,20120927,amazon.com,WINNIE THE POOH - FRANKENPOOH AND SPOOKABLE POOH N/A,1,99,5.43158E+11,6:31:34,0,9
5,3,3,6.99,1,1,4.04667E+18,23.59,98185701,20109,1,23,20120816,amazon.com,I AM TOO ABSOLUTELY SMALL FOR SCHOOL (CHARLIE AND LOLA) N/A,2,99,1.11526E+14,0:00:34,0,3
5,3,3,10.88,1,1,4.04667E+18,62.51,98185701,20109,1,23,20121030,amazon.com,THE HORUS HERESY  ANGEL EXTERMINATUS N/A,2,99,4.93992E+11,16:04:33,0,3
5,3,3,8.99,1,1,4.04667E+18,62.51,98185701,20109,1,23,20121030,amazon.com,SHADOWS OF TREACHERY (HORUS HERESY) N/A,2,99,4.93992E+11,16:04:33,0,3
6,4,4,11.99,1,1,4.04667E+18,32.95,98186372,91320,1,23,20121216,amazon.com,DISNEY ANIMATION COLLECTION 7 MICKEY'S CHRISTMAS CAROL N/A,1,99,4.10239E+11,20:35:47,0,6
7,4,2,37.9,1,1,4.04667E+18,74.08,98223123,55416,1,23,20120727,amazon.com,DRAGON BALL Z ULTIMATE TENKAICHI N/A,1,99,1.06727E+14,10:19:31,0,9
7,4,2,2.78,1,1,4.04667E+18,15.75,98223123,55416,1,23,20120411,amazon.com,RESERVOIR DOGS - (MR. WHITE) 10TH ANNIVERSARY SPECIAL LIMITED EDITION N/A,1,99,8.2286E+13,6:51:07,0,9
7,4,2,2.59,1,1,4.04667E+18,15.75,98223123,55416,1,23,20120411,amazon.com,RESERVOIR DOGS - (MR. BLOND) 10TH ANNIVERSARY SPECIAL LIMITED EDITION N/A,1,99,8.2286E+13,6:51:07,0,9
7,4,2,3.28,1,1,4.04667E+18,15.75,98223123,55416,1,23,20120411,amazon.com,RESERVOIR DOGS - (MR. PINK) 10TH ANNIVERSARY SPECIAL LIMITED EDITION N/A,1,99,8.2286E+13,6:51:07,0,9
7,4,2,2.88,1,1,4.04667E+18,15.75,98223123,55416,1,23,20120411,amazon.com,RESERVOIR DOGS -  (MR. BROWN) 10TH ANNIVERSARY SPECIAL LIMITED EDITION N/A,1,99,8.2286E+13,6:51:07,0,9
7,4,2,4.22,1,1,4.04667E+18,15.75,98223123,55416,1,23,20120411,amazon.com,RESERVOIR DOGS - (MR. ORANGE) 10TH ANNIVERSARY SPECIAL LIMITED EDITION N/A,1,99,8.2286E+13,6:51:07,0,9
7,4,2,6.99,1,1,4.04667E+18,38.94,98223123,55416,1,23,20120707,amazon.com,LET IT SNOW THREE HOLIDAY ROMANCES N/A,1,99,9.71121E+13,19:20:39,0,9
3,2,1,15.99,1,0,4.04667E+18,49.88,98225141,18252,1,23,20120519,amazon.com,TOLAND HOME GARDEN 102133 GLORY CHURCH HOUSE FLAG N/A,1,99,7.457E+13,11:22:54,0,8
7,4,2,19.43,1,1,4.04667E+18,28.42,98227690,63129,1,23,20121222,amazon.com,PATCH 5 SECOND RULE JUST SPIT IT OUT N/A,1,99,3.87499E+11,16:46:08,0,8
5,5,3,109,1,1,4.04667E+18,131.24,98227891,37323,1,23,20120206,amazon.com,JOICO K-PAK RECONSTRX VAPOR IRON ULTIMATE RECONSTRUCTION COLLECTION 2010 HOLIDAY BOXED SET N/A,1,99,7.41338E+13,17:28:09,0,8
