connection_speed,prod_qty,zip_code,basket_tot,event_time,hoh_oldest_age,domain_name,prod_category_id,prod_totprice,racial_background,country_of_origin,children,census_region,household_income,household_size,hoh_most_education,event_date,machine_id,domain_id,prod_name,site_session_id
1,1,07603,30.09,4:10:55,7,amazon.com,23,2.32,3,0,1,1,2,3,99,20120328,1.0188E8,4046669681622005860,OUR TOWN N/A,78003068146039
1,1,23605,66.66,1:46:56,4,amazon.com,23,15.25,2,0,1,3,1,3,99,20120322,1.0189E8,4046669681622005860,WEEDS SEASON SEVEN N/A,77999230816625
1,1,10462,99.44,1:01:26,4,amazon.com,23,18.00,1,0,0,1,3,1,99,20120307,1.0191E8,4046669681622005860,"PAUL MITCHELL AWAPUHI SHAMPOO, 33.8 OUNCE N/A",77156784345442
1,1,11030,29.17,5:34:50,10,amazon.com,23,10.19,3,0,1,1,7,2,99,20120325,1.0199E8,4046669681622005860,"BERSERK, VOL. 2 N/A",75722006466932
1,1,29506,17.93,20:19:33,1,amazon.com,23,4.95,1,0,1,3,1,5,99,20120321,1.0204E8,4046669681622005860,A BOY & HIS DOG N/A,78825864368496
1,1,56253,51.95,17:24:20,8,amazon.com,23,20.99,1,0,1,2,3,4,99,20120305,1.0205E8,4046669681622005860,TRANSFORMERS PRIME - THE COMPLETE FIRST SEASON N/A,77935168786784
1,1,56253,51.95,17:24:20,8,amazon.com,23,26.99,1,0,1,2,3,4,99,20120305,1.0205E8,4046669681622005860,AVATAR THE LAST AIRBENDER - THE COMPLETE BOOK TWO COLLECTION N/A,77935168786784
1,1,13021,33.97,15:20:28,11,amazon.com,23,20.99,1,0,0,1,4,2,99,20120313,1.0205E8,4046669681622005860,LES MISERABLES: THE 10TH ANNIVERSARY DREAM CAST IN CONCERT AT LONDON'S ROYAL ALBERT HALL (1995) N/A,78689565479272
1,1,16435,13.97,2:41:05,3,amazon.com,23,9.49,1,0,1,1,1,2,99,20120317,1.0205E8,4046669681622005860,"GALAXY QUEST (DELUXE EDITION) TIM ALLEN, SIGOURNEY WEAVER, ALAN RICKMAN, TONY SHALHOUB, SAM ROCKWELL, DARYL MITCHELL, ENRICO COLANTONI, ROBIN SACHS, PATRICK BREEN, MISSI PYLE, JED REES, JUSTIN LONG, D N/A",75671274131820
1,1,16435,12.47,23:42:00,3,amazon.com,23,7.99,1,0,1,1,1,2,99,20120325,1.0205E8,4046669681622005860,"HEAVYWEIGHTS TOM MCGOWAN, AARON SCHWARTZ, BEN STILLER, DAVID GOLDMAN, JOSEPH WAYNE MILLER, CODY BURGER, ALLEN COVERT, TIM BLAKE NELSON, NANCY RINGHAM, SETH ST. LAURENT, BOBBY FAIN, SHAUN WEISS, STEVEN N/A",75718828102004
1,1,16435,16.21,0:00:12,3,amazon.com,23,11.73,1,0,1,1,1,2,99,20120326,1.0205E8,4046669681622005860,"BROKEN LIZARD STANDS UP JAY CHANDRASEKHAR, KEVIN HEFFERNAN, STEVE LEMME, PAUL SOTER, ERIK STOLHANSKE MOVIES & TV N/A",78253341938037
1,1,16435,16.41,0:00:12,3,amazon.com,23,11.93,1,0,1,1,1,2,99,20120326,1.0205E8,4046669681622005860,"GONE IN 60 SECONDS (DIRECTOR'S CUT) NICOLAS CAGE, ANGELINA JOLIE, GIOVANNI RIBISI, T.J. CROSS, WILLIAM LEE SCOTT, SCOTT CAAN, JAMES DUVAL, WILL PATTON, DELROY LINDO, TIMOTHY OLYPHANT, CHI MCBRIDE, ROB N/A",78253341938037
1,1,16435,17.97,2:37:04,3,amazon.com,23,13.49,1,0,1,1,1,2,99,20120329,1.0205E8,4046669681622005860,"HIGHLANDER 2 - SPECIAL EDITION CHRISTOPHER LAMBERT, SEAN CONNERY, VIRGINIA MADSEN, MICHAEL IRONSIDE, ALLAN RICH, JOHN C. MCGINLEY, PHILLIP BROCK, RUSTY SCHWIMMER, ED TRUCCO, STEVEN GRIVES, JIMMY MURRA N/A",78726136205688
1,1,16435,14.47,2:37:04,3,amazon.com,23,9.99,1,0,1,1,1,2,99,20120329,1.0205E8,4046669681622005860,STEVEN SEAGAL LAWMAN  SEASON ONE  THE COMPLETE UNCUT EDITION STEVEN SEAGAL MOVIES & TV N/A,78726136205688
1,1,96707,64.79,6:30:38,7,amazon.com,23,0.92,3,0,1,4,6,4,99,20120311,1.0222E8,4046669681622005860,"LONDON - RED BUS POSTER PRINT, 24X36 COLLECTIONS POSTER PRINT, 24X36 N/A",76992821858662
1,1,96707,64.79,6:30:38,7,amazon.com,23,0.92,3,0,1,4,6,4,99,20120311,1.0222E8,4046669681622005860,"(24X36) KEEP CALM AND CARRY ON (MOTIVATIONAL, UNION JACK FLAG) ART POSTER PRINT N/A",76992821858662
1,1,85250,28.89,1:48:01,11,amazon.com,23,6.45,1,0,0,4,2,1,99,20120322,1.0223E8,4046669681622005860,1/2\\1 X 125' X 12\\1 BUBBLE WRAP (LARGE BUBBLES) N/A,78058040856945
1,1,32905,32.11,1:05:33,11,amazon.com,23,5.60,1,0,1,3,1,4,99,20120303,1.0246E8,4046669681622005860,SUBMISSION N/A,77210668306782
1,1,20036,54.94,5:16:02,9,amazon.com,23,9.84,1,0,1,3,7,4,99,20120306,1.0246E8,4046669681622005860,PERFECT SENSE POSTER - 2011 MOVIE PROMO FLYER - 11 X 17 - MAIN N/A,78239092773217
1,1,20036,54.94,5:16:02,9,amazon.com,23,7.34,1,0,1,3,7,4,99,20120306,1.0246E8,4046669681622005860,CASSANDRA'S DREAM POSTER MOVIE 11X17 COLIN FARRELL EWAN MCGREGOR TOM WILKINSON HAYLEY ATWELL N/A,78239092773217
1,1,20036,54.94,5:16:02,9,amazon.com,23,7.34,1,0,1,3,7,4,99,20120306,1.0246E8,4046669681622005860,IN BRUGES POSTER MOVIE UK 11X17 COLIN FARRELL JEAN-MARC FAVORIN RALPH FIENNES BRENDAN GLEESON N/A,78239092773217
1,1,78059,16.94,19:04:12,11,amazon.com,23,13.96,5,1,1,3,2,5,99,20120302,1.0251E8,4046669681622005860,THE TWILIGHT SAGA BREAKING DAWN - PART I (TWO-DISC SPECIAL EDITION) N/A,77030987534685
1,1,72956,112.87,14:16:58,7,amazon.com,23,96.14,1,0,1,3,5,2,99,20120325,1.027E8,4046669681622005860,"LOUISVILLE LADDER FS1506 ADVENT 300-POUND CAPACITY EXTRA HEAVY-DUTY FIBERGLASS STEPLADDER, 6-FOOT N/A",75817406763380
1,1,35234,62.00,13:14:51,7,amazon.com,23,15.50,2,0,1,3,1,5,99,20120309,1.027E8,4046669681622005860,UPON CRIMSON WATERS [FATEFULLY YOURS 2] (SIREN PUBLISHING LOVEXTREME FOREVER MANLOVE - SERIALIZED) N/A,76514848018788
1,1,35234,62.00,13:14:51,7,amazon.com,23,15.50,2,0,1,3,1,5,99,20120309,1.027E8,4046669681622005860,DARK DEVOTION [FATEFULLY YOURS 1] (SIREN PUBLISHING LOVEXTREME FOREVER MANLOVE) N/A,76514848018788
1,1,35234,85.47,18:17:40,7,amazon.com,23,9.99,2,0,1,3,1,5,99,20120331,1.027E8,4046669681622005860,BE WITH YOU N/A,76597066338682
1,1,35234,85.47,18:17:40,7,amazon.com,23,15.50,2,0,1,3,1,5,99,20120331,1.027E8,4046669681622005860,SURRENDERING TO SUMMER [WHISPERING MOUNTAIN 2] (SIREN PUBLISHING MENAGE AMOUR) (WHISPERING MOUNTAIN SIREN PUBLISHING MENAGE AMOUR) N/A,76597066338682
1,1,35234,85.47,18:17:40,7,amazon.com,23,7.49,2,0,1,3,1,5,99,20120331,1.027E8,4046669681622005860,MOON PACK VOLUME ONE N/A,76597066338682
1,1,35234,85.47,18:17:40,7,amazon.com,23,7.99,2,0,1,3,1,5,99,20120331,1.027E8,4046669681622005860,A WIZARD'S TOUCH VOLUME ONE N/A,76597066338682
1,1,35234,47.45,18:17:40,7,amazon.com,23,14.50,2,0,1,3,1,5,99,20120331,1.027E8,4046669681622005860,MICAH [THE MARIUS BROTHERS 1] (SIREN PUBLISHING CLASSIC MANLOVE) N/A,76597066338682
1,1,35234,47.45,18:17:40,7,amazon.com,23,12.99,2,0,1,3,1,5,99,20120331,1.027E8,4046669681622005860,REMUS [THE MARIUS BROTHERS 2] (SIREN PUBLISHING CLASSIC MANLOVE) N/A,76597066338682
1,1,35234,47.45,18:17:40,7,amazon.com,23,13.99,2,0,1,3,1,5,99,20120331,1.027E8,4046669681622005860,STEFAN [THE MARIUS BROTHERS 3] (SIREN PUBLISHING CLASSIC MANLOVE) N/A,76597066338682
1,1,37357,29.98,14:49:56,9,amazon.com,23,22.00,1,0,0,3,4,1,99,20120301,1.0271E8,4046669681622005860,SPARTACUS GODS OF THE ARENA [BLU-RAY] N/A,77884133085532
1,1,08533,39.30,15:40:00,7,amazon.com,23,13.40,1,0,1,1,4,6,99,20120308,1.0276E8,4046669681622005860,TIGER TALES N/A,75580567851363
1,1,08533,57.95,19:20:23,7,amazon.com,23,12.98,1,0,1,1,4,6,99,20120302,1.0276E8,4046669681622005860,STAR WARS EPISODE III REVENGE OF THE SITH N/A,77073208709469
1,1,60506,11.98,20:48:06,6,amazon.com,23,1.99,5,0,1,2,1,3,99,20120324,1.0278E8,4046669681622005860,PURPLE LOVE DESIGN HARD SNAP-ON CRYSTAL SKIN CASE COVER ACCESSORY FOR APPLE IPOD TOUCH 4TH GENERATION 4G 4 NEW N/A,75519650107763
1,1,87120,58.52,14:24:42,7,amazon.com,23,49.99,1,0,1,4,3,5,99,20120321,1.0278E8,4046669681622005860,FISKARS 7884 X27  36-INCH SUPER SPLITTING AXE N/A,79034898911600
1,1,23832,25.95,14:29:35,11,amazon.com,23,13.49,1,0,0,3,1,1,99,20120311,1.0287E8,4046669681622005860,BARBIE IN A MERMAID TALE 2 N/A,77008352842086
1,1,23832,25.95,14:29:35,11,amazon.com,23,8.49,1,0,0,3,1,1,99,20120311,1.0287E8,4046669681622005860,BARBIE IN A MERMAID TALE (2010) N/A,77008352842086
1,1,23832,72.93,14:29:35,11,amazon.com,23,5.99,1,0,0,3,1,1,99,20120311,1.0287E8,4046669681622005860,THIRTY SECONDS OVER TOKYO (1944) N/A,77008352842086
1,1,23832,72.93,14:29:35,11,amazon.com,23,5.49,1,0,0,3,1,1,99,20120311,1.0287E8,4046669681622005860,4 MOVIE MARATHON: CLASSIC WAR COLLECTION (WAKE ISLAND / TO HELL AND BACK / BATTLE HYMN / GRAY LADY DOWN) N/A,77008352842086
1,1,23832,72.93,14:29:35,11,amazon.com,23,5.49,1,0,0,3,1,1,99,20120311,1.0287E8,4046669681622005860,FOUR-MOVIE MARATHON CLASSIC WAR COLLECTION (WAKE ISLAND / TO HELL AND BACK / BATTLE HYMN / GRAY LADY DOWN) N/A,77008352842086
1,1,23832,72.93,14:29:35,11,amazon.com,23,17.99,1,0,0,3,1,1,99,20120311,1.0287E8,4046669681622005860,TCM GREATEST CLASSIC FILMS COLLECTION WAR - BATTLEFRONT ASIA (BATAAN / BACK TO BATAAN / THE GREEN BERETS / DESTINATION TOKYO) N/A,77008352842086
1,1,37825,43.96,20:11:28,4,amazon.com,23,17.99,1,0,0,3,1,1,99,20120308,1.0306E8,4046669681622005860,THE TWILIGHT SAGA BREAKING DAWN - PART I (TWO-DISC SPECIAL EDITION) N/A,75665045000547
1,1,49506,24.44,1:30:40,5,amazon.com,23,14.98,1,0,1,1,7,3,99,20120301,1.0307E8,4046669681622005860,SET OF 4 PEZ HAND PUPPETS BRIDE GROOM CLOWN FIREMAN N/A,77909478347100
1,1,80543,22.47,3:44:39,5,amazon.com,23,9.49,1,0,1,4,2,3,99,20120318,1.0307E8,4046669681622005860,"BILL COSBY, HIMSELF (1983) N/A",77026208059757
1,1,33330,22.29,5:06:15,4,amazon.com,23,17.31,1,1,0,2,7,2,99,20120304,1.0309E8,4046669681622005860,"YELLOW BOX WOMEN'S LAUGH SLIPPER,PURPLE,7 M US N/A",77986960839007
1,1,95203,40.29,14:41:43,11,amazon.com,23,8.99,1,0,0,4,6,2,99,20120331,1.0309E8,4046669681622005860,AND THE BAND PLAYED ON N/A,76577425854842
1,2,44121,267.97,0:29:26,8,amazon.com,23,138.00,1,0,1,2,5,4,99,20120328,1.0314E8,4046669681622005860,"WINSOME WOOD WINDSOR CHAIR, NATURAL, SET OF 2 N/A",78183011127671
1,1,30238,34.87,1:51:22,7,amazon.com,23,5.99,2,0,1,3,4,2,99,20120328,1.0329E8,4046669681622005860,SWEET FELLOWSHIP N/A,78232274407799
1,1,70812,37.88,18:21:20,6,amazon.com,23,8.29,2,0,1,3,5,5,99,20120320,1.0336E8,4046669681622005860,PREMIUM HYBRID CASE FOR AT&T GALAXY S2 I777 (INNER HARD SHELL + OUTER SILICONE) BLACK AND PURPLE (WITH FLIP OUT KICKSTAND) N/A,79189983301999
1,1,33825,15.36,12:34:02,11,amazon.com,23,10.88,2,0,0,3,1,1,99,20120328,1.0359E8,4046669681622005860,SAVE THE LAST DANCE FOR ME BEEGIE ADAIR MUSIC N/A,78238239101303
1,1,33825,118.68,12:34:02,11,amazon.com,23,8.99,2,0,0,3,1,1,99,20120328,1.0359E8,4046669681622005860,MACDOWELL WOODLAND SKETCHES / FIRESIDE TALES / NEW ENGLAND IDYLS N/A,78238239101303
1,1,33825,118.68,12:34:02,11,amazon.com,23,8.95,2,0,0,3,1,1,99,20120328,1.0359E8,4046669681622005860,TIME OUT!  DEVOTIONS FOR ATHLETES N/A,78238239101303
1,1,95953,31.38,18:37:40,7,amazon.com,23,0.89,1,0,1,4,3,4,99,20120325,1.0359E8,4046669681622005860,DOCTOR WHO DALEK TO VICTORY 24X36 POSTER TV PRINT N/A,75967850680692
1,1,77904,30.08,23:42:16,8,amazon.com,23,23.96,3,0,0,3,5,2,99,20120311,1.0359E8,4046669681622005860,TICKET TO RIDE INDIA MAP COLLECTION - VOLUME 2 N/A,77139255955814
1,1,97031,25.85,19:50:20,7,amazon.com,23,5.19,5,0,1,4,1,6,99,20120325,1.0361E8,4046669681622005860,MI SANGRE N/A,76008607125876
1,1,79701,21.92,14:57:21,6,amazon.com,23,6.99,1,1,1,3,1,3,99,20120324,1.0362E8,4046669681622005860,TEENAGE MUTANT NINJA TURTLES TMNT DONATELLO PURPLE WRISTBAND BRACELET W/SNAPS N/A,75583747854707
1,1,86004,13.49,13:30:31,11,amazon.com,23,9.50,1,0,0,4,5,2,99,20120326,1.0379E8,4046669681622005860,THE ROGUE RIVER GUIDE N/A,78511174062453
1,1,42503,109.51,19:58:15,3,amazon.com,23,13.20,1,0,0,3,3,4,99,20120315,1.0386E8,4046669681622005860,TORCHLIGHTERS: THE PERPETUA STORY N/A,79280700592490
1,1,42503,109.51,19:58:15,3,amazon.com,23,11.08,1,0,0,3,3,4,99,20120315,1.0386E8,4046669681622005860,TORCHLIGHTERS: THE JIM ELLIOT STORY N/A,79280700592490
1,1,42503,109.51,19:58:15,3,amazon.com,23,12.10,1,0,0,3,3,4,99,20120315,1.0386E8,4046669681622005860,TORCHLIGHTERS: ERIC LIDDELL N/A,79280700592490
1,1,42503,109.51,19:58:15,3,amazon.com,23,12.48,1,0,0,3,3,4,99,20120315,1.0386E8,4046669681622005860,TORCHLIGHTERS: THE RICHARD WURMBRAND STORY (2009) N/A,79280700592490
1,1,42503,109.51,19:58:15,3,amazon.com,23,13.49,1,0,0,3,3,4,99,20120315,1.0386E8,4046669681622005860,TORCHLIGHTERS: THE AMY CARMICHAEL STORY (2010) N/A,79280700592490
1,1,42503,109.51,19:58:15,3,amazon.com,23,13.49,1,0,0,3,3,4,99,20120315,1.0386E8,4046669681622005860,TORCHLIGHTERS: WILLIAM BOOTH STORY N/A,79280700592490
1,1,91381,26.26,0:51:55,4,amazon.com,23,2.19,1,0,1,4,7,2,99,20120327,1.0394E8,4046669681622005860,DRIED WHOLE GHOST CHILE (BHUT JOLOKIA) 18.16 GRAM (AROUND 15 PODS) N/A,78695254856054
1,1,76643,61.44,1:55:43,6,amazon.com,23,54.95,1,0,1,3,5,5,99,20120330,1.0394E8,4046669681622005860,S&W BODYGUARD 380 SNEAKY PETE HOLSTER (BELT CLIP) N/A,79116063609209
1,1,57761,25.49,4:42:04,1,amazon.com,23,17.99,1,0,1,2,5,5,99,20120317,1.0394E8,4046669681622005860,SUPERNATURAL FABRIC WALL SCROLL POSTER (21\\1 X 16\\1) INCHES N/A,75940316844396
1,1,36207,40.14,3:05:14,5,amazon.com,23,34.95,1,0,0,3,4,3,99,20120331,1.0399E8,4046669681622005860,AMOS & ANDY SHOW ALL 74 COMPLETE DVD SET N/A,76750806978938
1,1,61704,274.77,3:30:36,5,amazon.com,23,4.79,1,0,1,2,3,6,99,20120326,1.0399E8,4046669681622005860,HAL LEONARD ESSENTIAL ELEMENTS 2000 PLUS DVD ALTO SAXOPHONE BOOK 1 N/A,78585191600501
1,1,97062,53.49,19:12:13,8,amazon.com,23,6.95,1,0,1,4,6,2,99,20120317,1.0401E8,4046669681622005860,EASY-TO-MAKE CASTLE (DOVER CHILDREN'S ACTIVITY BOOKS) N/A,75995534070124
1,1,97062,53.49,19:12:13,8,amazon.com,23,9.78,1,0,1,4,6,2,99,20120317,1.0401E8,4046669681622005860,MAKE THIS MEDIEVAL CASTLE (CUT OUT MODELS) N/A,75995534070124
1,1,53204,137.40,22:18:38,4,amazon.com,23,112.41,1,1,0,4,1,1,99,20120331,1.0401E8,4046669681622005860,BLACKHAWK! S.T.R.I.K.E. PREDATOR  HYDRATION PACK - FOLIAGE GREEN N/A,76759285502330
1,1,85541,459.98,4:46:55,3,amazon.com,23,59.99,1,0,1,4,2,4,99,20120302,1.0406E8,4046669681622005860,SQUARETRADE 3-YEAR COMPUTER WARRANTY ($300-400 ITEMS) N/A,77283830927709
1,1,36203,41.98,1:52:59,5,amazon.com,23,35.99,1,0,1,3,5,4,99,20120328,1.0407E8,4046669681622005860,BARBIE AS GLINDA IN THE WIZARD OF OZ N/A,78331605225847
1,1,32901,35.31,21:36:27,11,amazon.com,23,16.33,1,0,1,3,3,2,99,20120329,1.0418E8,4046669681622005860,BANNON BROTHERS HONOR N/A,79065919066488
1,1,11368,28.99,4:41:52,11,amazon.com,23,28.99,3,0,0,1,1,3,99,20120331,1.042E8,4046669681622005860,QUEEN'S BLADE 2 THE EVIL EYE [BLU-RAY] N/A,76783639138682
1,1,72461,53.61,13:30:10,5,amazon.com,23,12.98,1,0,0,3,2,1,99,20120302,1.042E8,4046669681622005860,REIGN OF VENGEANCE N/A,77347559838045
1,1,19074,24.85,16:10:26,9,amazon.com,23,11.87,1,0,1,1,7,4,99,20120331,1.0422E8,4046669681622005860,COUNTRY STRONG ORIGINAL MOTION PICTURE N/A,76811615015290
1,1,06117,77.04,,4,amazon.com,23,26.00,1,0,1,1,7,4,99,20120315,1.0422E8,4046669681622005860,"HAVAIANAS WOMEN'S SLIM ANIMALS FLIP FLOP,GREY,37 BR/6.5-7.5 M US N/A",79345801433450
1,1,04562,29.68,0:40:01,9,amazon.com,23,8.41,1,0,0,1,5,2,99,20120304,1.0434E8,4046669681622005860,LIVE RECORD - ENGLAND N/A,78220957978975
1,1,29615,107.71,22:21:33,8,amazon.com,23,57.95,1,0,1,3,1,2,99,20120327,1.0434E8,4046669681622005860,TALL 60\\1 VINTAGE STYLE IRON METAL DRESS FORM MANNEQUIN N/A,78729282720118
1,1,20748,20.50,0:02:51,8,amazon.com,23,15.49,1,0,1,3,5,4,99,20120319,1.0434E8,4046669681622005860,PINK SILICONE SPIKED HEAD THRASHER LIX ORAL VIBRATING TONGUE RING BARBELL - FREE SHIPPING! N/A,78591956619630
1,1,10453,50.48,18:08:11,8,amazon.com,23,39.49,3,0,1,1,5,3,99,20120326,1.0446E8,4046669681622005860,DAWSON'S CREEK THE COMPLETE SERIES N/A,78671209173365
1,1,85041,9.15,6:49:07,2,amazon.com,23,3.96,2,0,1,4,2,5,99,20120323,1.0446E8,4046669681622005860,THE INDIAN IN THE CUPBOARD N/A,76297839120754
1,1,79907,43.97,3:37:35,6,amazon.com,23,35.99,2,1,1,3,1,3,99,20120306,1.0454E8,4046669681622005860,SAINT'S ROW THE THIRD N/A,78624964809057
1,1,10528,29.97,16:52:12,2,amazon.com,23,9.99,1,0,1,1,6,2,99,20120331,1.0457E8,4046669681622005860,BLOOD FOR THE MASTER N/A,76862192161146
1,1,10528,29.97,16:52:12,2,amazon.com,23,9.99,1,0,1,1,6,2,99,20120331,1.0457E8,4046669681622005860,THE ELECTRIC AGE N/A,76862192161146
1,1,35660,32.65,14:33:37,11,amazon.com,23,5.97,2,0,0,3,1,1,99,20120323,1.0468E8,4046669681622005860,SET IT OFF (KEEP CASE PACKAGING) N/A,76334788383090
1,1,35660,32.65,14:33:37,11,amazon.com,23,6.25,2,0,0,3,1,1,99,20120323,1.0468E8,4046669681622005860,WHAT'S LOVE GOT TO DO WITH IT? N/A,76334788383090
1,1,35660,32.65,14:33:37,11,amazon.com,23,7.99,2,0,0,3,1,1,99,20120323,1.0468E8,4046669681622005860,THE FIVE HEARTBEATS - 15TH ANNIVERSARY SPECIAL EDITION (FULL SCREEN) N/A,76334788383090
1,1,35660,32.65,14:33:37,11,amazon.com,23,6.49,2,0,0,3,1,1,99,20120323,1.0468E8,4046669681622005860,THE COLOR PURPLE N/A,76334788383090
1,1,96003,11.97,4:31:47,11,amazon.com,23,7.49,1,0,0,4,4,2,99,20120310,1.0474E8,4046669681622005860,STEEL MAGNOLIAS/SLEEPLESS IN SEATTLE TOM HANKS MOVIES & TV N/A,77125229089125
1,1,70815,270.45,20:27:19,5,amazon.com,23,71.99,1,0,0,3,3,2,99,20120325,1.0483E8,4046669681622005860,HIP HOP ABS DVD SET - 6 WORKOUTS SET N/A,76178207871348
1,1,62864,68.95,20:16:09,8,amazon.com,23,9.77,1,0,1,2,7,4,99,20120303,1.0484E8,4046669681622005860,AMERICAN VI AIN'T NO GRAVE N/A,77631668818270
1,1,62864,68.95,20:16:09,8,amazon.com,23,2.99,1,0,1,2,7,4,99,20120303,1.0484E8,4046669681622005860,"DINERS, DRIVE-INS AND DIVES ROAD SONGS THAT ROCK - HAND PICKED BY GUY FIERI N/A",77631668818270
1,1,80525,32.30,2:50:48,8,amazon.com,23,9.25,1,0,1,4,6,4,99,20120315,1.0493E8,4046669681622005860,MEET THE ROBINSONS N/A,79412996477290
1,1,80525,32.30,2:50:48,8,amazon.com,23,17.09,1,0,1,4,6,4,99,20120315,1.0493E8,4046669681622005860,THE VAMPIRE DIARIES THE COMPLETE FIRST SEASON N/A,79412996477290
1,1,70087,8.93,3:02:03,7,amazon.com,23,5.95,1,0,1,3,6,5,99,20120302,1.0494E8,4046669681622005860,DEAD HUSBANDS [VHS] N/A,77462053392733
1,1,90032,9.18,23:34:52,9,amazon.com,23,3.99,5,0,1,4,1,6,99,20120323,1.0502E8,4046669681622005860,LIVE N/A,76383175577970
1,1,90032,8.44,1:37:56,9,amazon.com,23,3.25,5,0,1,4,1,6,99,20120309,1.0502E8,4046669681622005860,HAROLD AND MAUDE N/A,76844034167140
1,1,90032,5.20,22:49:32,9,amazon.com,23,0.01,5,0,1,4,1,6,99,20120310,1.0502E8,4046669681622005860,STOP MAKING SENSE TALKING HEADS N/A,77127654576485
1,1,90032,33.80,0:24:55,9,amazon.com,23,26.81,5,0,1,4,1,6,99,20120330,1.0502E8,4046669681622005860,INTERVIEW WITH THE VAMPIRE N/A,79260564328825
1,1,90032,13.97,0:20:18,9,amazon.com,23,10.99,5,0,1,4,1,6,99,20120315,1.0502E8,4046669681622005860,THE RIVER N/A,79447754805610
1,1,20148,12.23,13:17:19,7,amazon.com,23,3.25,1,0,1,3,7,5,99,20120314,1.0503E8,4046669681622005860,INDIANA JONES ADVENTURE MOVIE FILM STICKER DECAL N/A,79228563231081
1,1,97383,38.95,11:37:36,9,amazon.com,23,14.99,1,0,0,4,2,3,99,20120318,1.0507E8,4046669681622005860,BODYGUARDS & ASSASSINS N/A,77359956037997
1,1,13210,161.16,14:10:44,8,amazon.com,23,12.00,2,0,1,1,5,5,99,20120313,1.0518E8,4046669681622005860,HOPE DEFERRED NARRATIVES OF ZIMBABWEAN LIVES (VOICE OF WITNESS) N/A,79158801797480
1,1,23704,143.93,21:06:51,4,amazon.com,23,11.98,3,1,1,3,2,2,99,20120320,1.0518E8,4046669681622005860,WOMEN'S GENEVA LARGE FACE BLACK / PINK SILICONE RUBBER JELLY WITH CZ CRYSTAL RHINESTONES BIG BLING N/A,79446763639151
1,1,93535,11.47,23:08:18,10,amazon.com,23,6.99,1,0,1,4,1,2,99,20120303,1.0518E8,4046669681622005860,"STANDING IN THE SHADOWS OF MOTOWN JOE HUNTER, JACK ASHFORD, URIEL JONES, RICHARD 'PISTOL' ALLEN, BOB BABBITT, BENNY 'PAPA ZITA' BENJAMIN, EDDIE 'BONGO' BROWN, BOOTSY COLLINS, JOHNNY GRIFFITH, BEN HARP N/A",77705787543902
1,1,95032,37.52,13:27:13,11,amazon.com,23,10.38,1,0,0,4,5,2,99,20120323,1.0518E8,4046669681622005860,THE TRUTH (WITH JOKES) N/A,76434585293170
1,1,46360,146.31,0:03:27,11,amazon.com,23,0.01,1,0,0,2,5,1,99,20120319,1.0519E8,4046669681622005860,RETURN TO ARMAGEDDON (PHOENIX FORCE #11) N/A,78708908953966
1,1,46360,146.31,0:03:27,11,amazon.com,23,0.01,1,0,0,2,5,1,99,20120319,1.0519E8,4046669681622005860,"DOOMSDAY SYNDROME (PHOENIX FORCE, NO. 24) N/A",78708908953966
1,1,46360,146.31,0:03:27,11,amazon.com,23,0.01,1,0,0,2,5,1,99,20120319,1.0519E8,4046669681622005860,NIGHT OF THE THUGGEE (PHOENIX FORCE) N/A,78708908953966
1,1,46360,146.31,0:03:27,11,amazon.com,23,0.01,1,0,0,2,5,1,99,20120319,1.0519E8,4046669681622005860,TWISTED CROSS (PHOENIX FORCE NO. 21) N/A,78708908953966
1,1,46360,146.31,0:03:27,11,amazon.com,23,0.01,1,0,0,2,5,1,99,20120319,1.0519E8,4046669681622005860,ARGENTINE DEADLINE PHOENIX FORCE #1 AN EXECUTIONER SERIES N/A,78708908953966
1,1,46360,146.31,0:03:27,11,amazon.com,23,0.30,1,0,0,2,5,1,99,20120319,1.0519E8,4046669681622005860,HARVEST HELL (PHOENIX FORCE) N/A,78708908953966
1,1,46360,146.31,0:03:27,11,amazon.com,23,0.01,1,0,0,2,5,1,99,20120319,1.0519E8,4046669681622005860,WHITE HELL (PHOENIX FORCE #6) N/A,78708908953966
1,1,46360,146.31,0:03:27,11,amazon.com,23,0.99,1,0,0,2,5,1,99,20120319,1.0519E8,4046669681622005860,"ATLANTIC SCRAMBLE (THE EXECUTIONER, PHOENIX FORCE NO. 3) N/A",78708908953966
1,1,46360,146.31,0:03:27,11,amazon.com,23,0.01,1,0,0,2,5,1,99,20120319,1.0519E8,4046669681622005860,"THE NIGHTMARE MERCHANTS (PHOENIX FORCE, NO 29) N/A",78708908953966
1,1,46360,146.31,0:03:27,11,amazon.com,23,0.97,1,0,0,2,5,1,99,20120319,1.0519E8,4046669681622005860,DOWN UNDER THUNDER (PHOENIX FORCE) N/A,78708908953966
1,1,46360,146.31,0:03:27,11,amazon.com,23,0.01,1,0,0,2,5,1,99,20120319,1.0519E8,4046669681622005860,"THE BLACK ALCHEMISTS (PHOENIX FORCE, #12) (AN EXECUTIONER SERIES) N/A",78708908953966
1,1,91352,4.83,22:22:54,2,amazon.com,23,1.85,5,0,1,4,2,4,99,20120317,1.0537E8,4046669681622005860,"NEW SEALED - REALD COMPATIBLE 3D CIRCULAR POLARIZED GLASSES FOR LEGEND OF THE GUARDIANS, RESIDENT EVIL AFTERLIFE 3D, PIRANHA 3D, TOY STORY 3 3D N/A",76254270394732
1,1,14220,62.98,21:06:19,7,amazon.com,23,17.99,1,0,0,1,2,1,99,20120315,1.0543E8,4046669681622005860,THE TWILIGHT SAGA BREAKING DAWN - PART I (TWO-DISC SPECIAL EDITION) N/A,79564311957866
1,2,95831,342.58,9:59:40,3,amazon.com,23,140.80,1,0,1,4,5,6,99,20120329,1.0548E8,4046669681622005860,"COASTER CONTEMPORARY STYLE DINING CHAIRS, CAPPUCCINO WOOD FINISH, SET OF 2 N/A",79331961803128
1,1,40422,25.89,23:32:28,6,amazon.com,23,13.40,1,0,1,3,7,6,99,20120315,1.0548E8,4046669681622005860,ISRAELI ISSUE GAS MASK WITH DRINKING TUBE & SEALED FILTER N/A,79551899570538
1,1,89134,127.09,7:22:40,9,amazon.com,23,4.80,1,0,0,4,6,3,99,20120306,1.0548E8,4046669681622005860,(24X36) IRON MAN 2 MOVIE GROUP POSTER PRINT N/A,78815194059105
1,1,89134,127.09,7:22:40,9,amazon.com,23,27.49,1,0,0,4,6,3,99,20120306,1.0548E8,4046669681622005860,CAPTAIN AMERICA THE FIRST AVENGER (TWO-DISC BLU-RAY/DVD COMBO + DIGITAL COPY) N/A,78815194059105
1,1,98203,12.00,1:06:38,4,amazon.com,23,2.99,1,0,0,4,2,3,99,20120323,1.0564E8,4046669681622005860,MONKEY TROUBLE N/A,76564546130290
1,1,48178,56.42,3:16:08,5,amazon.com,23,10.17,1,0,1,2,5,3,99,20120301,1.0579E8,4046669681622005860,"LOVE ADDICT SEX, ROMANCE, AND OTHER DANGEROUS DRUGS N/A",78442623078748
1,1,20124,21.64,17:28:22,9,amazon.com,23,9.99,1,0,1,3,6,2,99,20120325,1.0579E8,4046669681622005860,MAMMA MIA! THE MOVIE (WIDESCREEN) N/A,76340658901364
1,1,20124,21.64,17:28:22,9,amazon.com,23,5.70,1,0,1,3,6,2,99,20120325,1.0579E8,4046669681622005860,MUSIC AND LYRICS (WIDESCREEN EDITION) N/A,76340658901364
1,1,02367,13.39,14:06:52,11,amazon.com,23,10.41,1,0,0,1,5,3,99,20120311,1.0579E8,4046669681622005860,RAMONES IT'S ALIVE 1974-1996 THE ULTIMATE DOUBLE LIVE DVD N/A,77632817729894
1,1,55337,7.00,22:13:46,11,amazon.com,23,0.01,1,0,1,2,5,2,99,20120301,1.058E8,4046669681622005860,A RATHER CHARMING INVITATION N/A,78413590892892
1,1,75154,43.44,1:47:21,5,amazon.com,23,0.75,2,0,1,3,6,4,99,20120310,1.058E8,4046669681622005860,PURPLE RUBBERIZED HARD CASE PHONE GUARD PROTECTOR COVER FOR HTC MYTOUCH 3G SLIDE T-MOBILE N/A,77289919877477
1,1,49221,47.33,1:59:23,9,amazon.com,23,12.94,1,1,1,2,7,5,99,20120310,1.0597E8,4046669681622005860,"SE 8 LED FLASHLIGHT (4 WHITE LED,4 RED LED,1 LASER) W/POUCH N/A",77341948318053
1,1,23692,66.01,13:55:24,5,amazon.com,23,5.99,2,0,1,3,4,5,99,20120328,1.0598E8,4046669681622005860,BRIGHT LIGHTS EP N/A,78722070876535
1,1,23692,66.01,13:55:24,5,amazon.com,23,7.00,2,0,1,3,4,5,99,20120328,1.0598E8,4046669681622005860,DOING HIS TIME (WHO SAID DATING A BALLER WAS EASY?) N/A,78722070876535
1,1,23692,66.01,13:55:24,5,amazon.com,23,8.67,2,0,1,3,4,5,99,20120328,1.0598E8,4046669681622005860,CARTEL 3 THE LAST CHAPTER N/A,78722070876535
1,1,32822,44.43,21:28:04,10,amazon.com,23,9.49,1,0,0,3,3,1,99,20120317,1.0598E8,4046669681622005860,48 HRS. / ANOTHER 48 HRS. (1990) N/A,76344929096044
1,1,32822,44.43,21:28:04,10,amazon.com,23,14.99,1,0,0,3,3,1,99,20120317,1.0598E8,4046669681622005860,BEVERLY HILLS COP COLLECTION (BEVERLY HILLS COP / BEVERLY HILLS COP II / BEVERLY HILLS COP III) N/A,76344929096044
1,1,32822,34.55,20:01:49,10,amazon.com,23,7.99,1,0,0,3,3,1,99,20120331,1.0598E8,4046669681622005860,GONE FOR SOLDIERS N/A,77098235007354
1,1,32822,26.19,20:52:45,10,amazon.com,23,1.49,1,0,0,3,3,1,99,20120301,1.0598E8,4046669681622005860,L. A. CONFIDENTIAL N/A,78450851647836
1,1,32822,40.37,19:24:17,10,amazon.com,23,9.85,1,0,0,3,3,1,99,20120301,1.0598E8,4046669681622005860,THE GODFATHER PART II (1974 FILM) N/A,78450857152860
1,1,32822,40.37,19:24:17,10,amazon.com,23,15.57,1,0,0,3,3,1,99,20120301,1.0598E8,4046669681622005860,THE HOLIDAY N/A,78450857152860
1,1,32822,61.96,22:31:52,10,amazon.com,23,13.73,1,0,0,3,3,1,99,20120313,1.0598E8,4046669681622005860,"PETER, PAUL & MARY: 25TH ANNIVERSARY CONCERT (2011) N/A",79331448656232
1,1,32822,66.94,18:13:05,10,amazon.com,23,5.84,1,0,0,3,3,1,99,20120329,1.0598E8,4046669681622005860,ULTIMATE COLLECTION N/A,79398027989368
1,1,32822,66.94,18:13:05,10,amazon.com,23,5.73,1,0,0,3,3,1,99,20120329,1.0598E8,4046669681622005860,THE COMPLETE DUETS N/A,79398027989368
1,1,32822,51.91,18:13:05,10,amazon.com,23,4.89,1,0,0,3,3,1,99,20120329,1.0598E8,4046669681622005860,ULTIMATE COLLECTION N/A,79398027989368
