Household Income,Household Size,Census Region,Product Total Price,Connection Speed,Children Present,Domain ID,Basket Total,Machine Identifier,Zip Code,product Quantity,Product Category ID,Date of Activity,Domain Name,Product Name,Racial Background,Most Education -- Head of Household,Site Session ID,Time of Activity,Country of Origin,Oldest Age -- Head of Household
1,2,1,0.99,1,1,4.04667E+18,0.99,97415692,13208,1,48,20120116,amazon.com,I COULD NEVER TAKE THE PLACE OF YOUR MAN [EXPLICIT] MUSIC DOWNLOAD,2,99,7.65656E+13,12:11:27,1,6
1,2,1,0.99,1,1,4.04667E+18,0.99,97415692,13208,1,48,20120116,amazon.com,GASOLINA MUSIC DOWNLOAD,2,99,7.65656E+13,12:11:27,1,6
1,2,1,1.29,1,1,4.04667E+18,1.29,97415692,13208,1,48,20120116,amazon.com,NEVER AS GOOD AS THE FIRST TIME (REMASTERED VERSION) MUSIC DOWNLOAD,2,99,7.65656E+13,12:11:27,1,6
1,2,1,0.99,1,1,4.04667E+18,0.99,97415692,13208,1,48,20120116,amazon.com,DREAMS MUSIC DOWNLOAD,2,99,7.65656E+13,12:11:27,1,6
1,2,1,0.99,1,1,4.04667E+18,0.99,97415692,13208,1,48,20120116,amazon.com,THE BREAKS MUSIC DOWNLOAD,2,99,7.65656E+13,12:11:27,1,6
1,2,1,0.99,1,1,4.04667E+18,0.99,97415692,13208,1,48,20120116,amazon.com,ALL THAT JAZZ (FROM 'CHICAGO') MUSIC DOWNLOAD,2,99,7.65656E+13,12:11:27,1,6
1,5,1,15.17,1,1,4.04667E+18,19.16,97417350,7103,1,48,20121019,amazon.com,THE ONE WORLD SCHOOLHOUSE EDUCATION REIMAGINED N/A,3,99,4.41126E+11,19:01:59,0,5
1,5,1,15.16,1,1,4.04667E+18,27.14,97417350,7103,1,48,20121012,amazon.com,THE ONE WORLD SCHOOLHOUSE EDUCATION REIMAGINED N/A,3,99,4.62837E+11,22:19:56,0,5
2,3,3,0,1,0,4.04667E+18,0,97419720,7105,1,48,20120203,amazon.com,LONESOME MUSIC DOWNLOAD,1,99,7.40512E+13,2:19:47,0,9
1,2,4,32.64,1,0,4.04667E+18,73.56,97422265,92701,3,48,20120612,amazon.com,"THE SOCIAL ANIMAL THE HIDDEN SOURCES OF LOVE, CHARACTER, AND ACHIEVEMENT N/A",3,99,1.039E+14,19:12:10,0,11
7,2,2,0.99,1,0,4.04667E+18,5.47,97461089,60585,1,48,20120908,amazon.com,QUE BELLO SONORA TROPICANA MP3 DOWNLOADS N/A,5,99,4.7888E+11,16:07:47,0,8
5,4,2,0.99,1,1,4.04667E+18,5.47,97466213,44145,1,48,20120816,amazon.com,LUKA SUZANNE VEGA MP3 DOWNLOADS N/A,1,99,1.11505E+14,20:00:14,0,6
7,2,4,9.99,1,0,4.04667E+18,9.99,97470579,95129,1,48,20120507,amazon.com,WEARING SOMEONE ELSE'S CLOTHES MUSIC DOWNLOAD,3,99,8.02661E+13,22:49:21,0,5
6,2,3,0.99,1,1,4.04667E+18,0.99,97520392,48009,1,48,20120410,amazon.com,LIVIN' ON A PRAYER MUSIC DOWNLOAD,1,99,8.22259E+13,18:02:02,0,3
5,5,4,0.99,1,1,4.04667E+18,5.47,97529529,85745,1,48,20121215,amazon.com,ALONE TRAMPLED BY TURTLES MP3 DOWNLOADS N/A,1,99,3.71221E+11,2:06:41,0,8
5,5,4,0.99,1,1,4.04667E+18,5.47,97529529,85745,1,48,20121207,amazon.com,MASS PRODUCTION IGGY POP MP3 DOWNLOADS N/A,1,99,3.86889E+11,22:58:43,0,8
5,5,4,0.99,1,1,4.04667E+18,5.47,97529529,85745,1,48,20121202,amazon.com,ROLAND INTERPOL MP3 DOWNLOADS N/A,1,99,4.06086E+11,22:43:21,0,8
5,5,4,1.29,1,1,4.04667E+18,5.77,97529529,85745,1,48,20121203,amazon.com,SIMPLE SONG THE SHINS MP3 DOWNLOADS N/A,1,99,4.19194E+11,2:52:30,0,8
3,2,1,0.99,1,1,4.04667E+18,0.99,97529599,91708,1,48,20120829,amazon.com,RELEASE ME (FROM MY SIN) MUSIC DOWNLOAD,2,99,1.16367E+14,2:41:53,1,4
3,2,1,0.99,1,1,4.04667E+18,0.99,97529599,91708,1,48,20120101,amazon.com,CANDLE IN THE WIND MUSIC DOWNLOAD,2,99,6.02443E+13,23:20:15,1,4
3,2,1,0.99,1,1,4.04667E+18,0.99,97529599,91708,1,48,20120101,amazon.com,SHE'S THE ONE MUSIC DOWNLOAD,2,99,6.02443E+13,23:20:15,1,4
3,2,1,0.99,1,1,4.04667E+18,0.99,97529599,91708,1,48,20120225,amazon.com,HONKY TONK MUSIC DOWNLOAD,2,99,7.36059E+13,19:20:12,1,4
3,2,1,0.99,1,1,4.04667E+18,0.99,97529599,91708,1,48,20120225,amazon.com,"BRIGHT LIGHTS, BIG CITY MUSIC DOWNLOAD",2,99,7.36059E+13,19:20:12,1,4
3,2,1,0.99,1,1,4.04667E+18,0.99,97529599,91708,1,48,20120210,amazon.com,RHIANNON MUSIC DOWNLOAD,2,99,7.37972E+13,4:29:49,1,4
3,2,1,0.99,1,1,4.04667E+18,0.99,97529599,91708,1,48,20120210,amazon.com,GO YOUR OWN WAY MUSIC DOWNLOAD,2,99,7.37972E+13,4:29:49,1,4
3,2,1,0.99,1,1,4.04667E+18,0.99,97529599,91708,1,48,20120210,amazon.com,GETTIN' BY MUSIC DOWNLOAD,2,99,7.37972E+13,2:49:58,1,4
3,2,1,0.99,1,1,4.04667E+18,0.99,97529599,91708,1,48,20120210,amazon.com,WISHING FOR YOUR LOVE MUSIC DOWNLOAD,2,99,7.37972E+13,2:49:58,1,4
3,2,1,0.99,1,1,4.04667E+18,0.99,97529599,91708,1,48,20120222,amazon.com,BIRD ON A WIRE MUSIC DOWNLOAD,2,99,7.55055E+13,5:00:59,1,4
3,2,1,0.99,1,1,4.04667E+18,0.99,97529599,91708,1,48,20120216,amazon.com,LEATHER AND LACE MUSIC DOWNLOAD,2,99,7.59694E+13,15:39:20,1,4
3,2,1,0.99,1,1,4.04667E+18,0.99,97529599,91708,1,48,20120216,amazon.com,DON'T YOU LOVE ME ANYMORE MUSIC DOWNLOAD,2,99,7.59694E+13,4:48:48,1,4
3,2,1,0.99,1,1,4.04667E+18,0.99,97529599,91708,1,48,20120304,amazon.com,STILL WATER (LOVE) MUSIC DOWNLOAD,2,99,7.72053E+13,19:22:52,1,4
3,2,1,0.99,1,1,4.04667E+18,0.99,97529599,91708,1,48,20120304,amazon.com,JUST MY IMAGINATION (RUNNING AWAY WITH ME) MUSIC DOWNLOAD,2,99,7.72053E+13,19:22:52,1,4
3,2,1,0.99,1,1,4.04667E+18,0.99,97529599,91708,1,48,20120304,amazon.com,IT AIN'T EASY BEIN' EASY MUSIC DOWNLOAD,2,99,7.72053E+13,19:22:52,1,4
3,2,1,0.99,1,1,4.04667E+18,0.99,97529599,91708,1,48,20120304,amazon.com,SOMETIMES I DREAM MUSIC DOWNLOAD,2,99,7.72053E+13,1:38:39,1,4
3,2,1,0.99,1,1,4.04667E+18,0.99,97529599,91708,1,48,20120304,amazon.com,GOT MY MOJO WORKIN' MUSIC DOWNLOAD,2,99,7.72053E+13,1:38:39,1,4
3,2,1,0.99,1,1,4.04667E+18,0.99,97529599,91708,1,48,20120313,amazon.com,OH DARLIN' MUSIC DOWNLOAD,2,99,7.80684E+13,0:41:58,1,4
3,2,1,0.99,1,1,4.04667E+18,0.99,97529599,91708,1,48,20120708,amazon.com,WON'T BE THE LAST TIME MUSIC DOWNLOAD,2,99,9.81356E+13,17:43:23,1,4
3,2,1,0.99,1,1,4.04667E+18,0.99,97529599,91708,1,48,20120708,amazon.com,IN THE SPRING MUSIC DOWNLOAD,2,99,9.81356E+13,2:44:43,1,4
3,2,1,0.69,1,1,4.04667E+18,0.69,97529599,91708,1,48,20120708,amazon.com,NOTHING'S GONNA CHANGE THE WAY YOU FEEL ABOUT ME NOW MUSIC DOWNLOAD,2,99,9.81356E+13,2:44:43,1,4
3,2,1,0.69,1,1,4.04667E+18,0.69,97529599,91708,1,48,20120722,amazon.com,SO YOU DON'T HAVE TO LOVE ME ANYMORE MUSIC DOWNLOAD,2,99,9.96696E+13,1:49:30,1,4
4,5,3,0.69,1,1,4.04667E+18,5.17,97541313,42041,1,48,20121116,amazon.com,STARRY NIGHT CHRIS AUGUST MP3 DOWNLOADS N/A,1,99,4.06283E+11,0:26:03,0,6
4,5,3,0.99,1,1,4.04667E+18,0.99,97541313,42041,1,48,20120101,amazon.com,FIREWORK MUSIC DOWNLOAD,1,99,6.02848E+13,1:59:46,0,6
4,5,3,0.99,1,1,4.04667E+18,0.99,97541313,42041,1,48,20120106,amazon.com,PARTY ROCK ANTHEM MUSIC DOWNLOAD,1,99,7.16167E+13,19:46:35,0,6
4,5,3,0.99,1,1,4.04667E+18,0.99,97541313,42041,1,48,20120105,amazon.com,7X70 MUSIC DOWNLOAD,1,99,7.17208E+13,20:18:09,0,6
4,5,3,1.29,1,1,4.04667E+18,1.29,97541313,42041,1,48,20120105,amazon.com,BIG NIGHT MUSIC DOWNLOAD,1,99,7.17208E+13,20:18:09,0,6
4,5,3,1.29,1,1,4.04667E+18,1.29,97541313,42041,1,48,20120105,amazon.com,IF I RULED THE WORLD MUSIC DOWNLOAD,1,99,7.17208E+13,20:18:09,0,6
4,5,3,0.99,1,1,4.04667E+18,0.99,97541313,42041,1,48,20120112,amazon.com,WATCH ME MUSIC DOWNLOAD,1,99,7.48808E+13,20:17:58,0,6
4,5,3,0.99,1,1,4.04667E+18,0.99,97541313,42041,1,48,20120112,amazon.com,CALLING ALL THE MONSTERS MUSIC DOWNLOAD,1,99,7.48808E+13,20:17:58,0,6
7,5,2,162.05,1,1,4.04667E+18,236.3,97667418,48154,1,48,20120818,amazon.com,LOOSE LEAF INTERMEDIATE ACCOUNTING WITH ANNUAL REPORT N/A,1,99,1.02009E+14,22:19:11,1,7
5,3,3,0.99,1,1,4.04667E+18,0.99,97681989,75965,1,48,20120711,amazon.com,BACK (RADIO EDIT) MUSIC DOWNLOAD,1,99,1.08688E+14,22:05:13,0,3
4,2,3,0.99,1,0,4.04667E+18,0.99,97692590,79015,1,48,20120120,amazon.com,ARRIVAL OF THE QUEEN SHEBA MUSIC DOWNLOAD,1,99,7.39272E+13,6:30:05,0,1
3,4,2,0.99,1,1,4.04667E+18,5.47,97776415,62032,1,48,20121222,amazon.com,PRICE TAG JESSIE J MP3 DOWNLOADS N/A,1,99,3.44683E+11,21:38:01,0,8
7,2,1,9.99,1,1,4.04667E+18,9.99,97792668,6790,1,48,20120212,amazon.com,I LOOK TO YOU MUSIC DOWNLOAD,5,99,7.58474E+13,22:58:27,1,7
7,2,1,0.99,1,1,4.04667E+18,0.99,97792668,6790,1,48,20120212,amazon.com,FOR EVERY MOUNTAIN MUSIC DOWNLOAD,5,99,7.58474E+13,22:58:27,1,7
5,1,3,1.29,1,0,4.04667E+18,1.29,97794250,28659,1,48,20120628,amazon.com,WHAT I NEED TO DO (LIVE) MUSIC DOWNLOAD,1,99,1.01331E+14,9:12:26,0,10
5,1,3,0.99,1,0,4.04667E+18,0.99,97794250,28659,1,48,20120628,amazon.com,UNBROKEN MUSIC DOWNLOAD,1,99,1.01331E+14,9:12:26,0,10
5,1,3,0.99,1,0,4.04667E+18,0.99,97794250,28659,1,48,20120626,amazon.com,EVERYWHERE MUSIC DOWNLOAD,1,99,1.02422E+14,9:10:20,0,10
5,1,3,7.99,1,0,4.04667E+18,7.99,97794250,28659,1,48,20120605,amazon.com,JANA KRAMER MUSIC DOWNLOAD,1,99,1.03669E+14,9:02:10,0,10
5,1,3,1.29,1,0,4.04667E+18,1.29,97794250,28659,1,48,20120727,amazon.com,TAKE A LITTLE RIDE MUSIC DOWNLOAD,1,99,1.06688E+14,9:26:47,0,10
5,1,3,1.29,1,0,4.04667E+18,1.29,97794250,28659,1,48,20120727,amazon.com,CELEBRITY MUSIC DOWNLOAD,1,99,1.06688E+14,9:26:47,0,10
5,1,3,1.29,1,0,4.04667E+18,1.29,97794250,28659,1,48,20120712,amazon.com,ANYWHERE WITH YOU MUSIC DOWNLOAD,1,99,1.08764E+14,9:46:42,0,10
5,1,3,1.29,1,0,4.04667E+18,1.29,97794250,28659,1,48,20120712,amazon.com,YEE HAW MUSIC DOWNLOAD,1,99,1.08764E+14,9:46:42,0,10
5,1,3,1.19,1,0,4.04667E+18,1.19,97794250,28659,1,48,20120719,amazon.com,SOMETHING LIKE THAT MUSIC DOWNLOAD,1,99,1.09969E+14,9:25:35,0,10
5,1,3,0.99,1,0,4.04667E+18,0.99,97794250,28659,1,48,20120719,amazon.com,DOWN ON THE FARM MUSIC DOWNLOAD,1,99,1.09969E+14,9:25:35,0,10
5,1,3,1.19,1,0,4.04667E+18,1.19,97794250,28659,1,48,20120719,amazon.com,THE COWBOY IN ME MUSIC DOWNLOAD,1,99,1.09969E+14,9:25:35,0,10
5,1,3,1.19,1,0,4.04667E+18,1.19,97794250,28659,1,48,20120719,amazon.com,WHERE THE GREEN GRASS GROWS MUSIC DOWNLOAD,1,99,1.09969E+14,9:25:35,0,10
5,1,3,0.99,1,0,4.04667E+18,0.99,97794250,28659,1,48,20120719,amazon.com,I NEED YOU (WITH FAITH HILL) MUSIC DOWNLOAD,1,99,1.09969E+14,9:25:35,0,10
5,1,3,0.99,1,0,4.04667E+18,0.99,97794250,28659,1,48,20120226,amazon.com,ON THE FLOOR MUSIC DOWNLOAD,1,99,7.39549E+13,23:47:09,0,10
5,1,3,0.99,1,0,4.04667E+18,0.99,97794250,28659,1,48,20120226,amazon.com,FOR YOU MUSIC DOWNLOAD,1,99,7.3955E+13,0:37:57,0,10
5,1,3,1.19,1,0,4.04667E+18,1.19,97794250,28659,1,48,20120519,amazon.com,HALO MUSIC DOWNLOAD,1,99,7.45344E+13,9:18:49,0,10
5,1,3,0.99,1,0,4.04667E+18,0.99,97794250,28659,1,48,20120519,amazon.com,LIVE LIKE YOU WERE DYING MUSIC DOWNLOAD,1,99,7.45344E+13,9:18:49,0,10
5,1,3,1.29,1,0,4.04667E+18,1.29,97794250,28659,1,48,20120519,amazon.com,AIN'T BACK YET MUSIC DOWNLOAD,1,99,7.45344E+13,9:18:49,0,10
5,1,3,0.99,1,0,4.04667E+18,0.99,97794250,28659,1,48,20120202,amazon.com,SEXY AND I KNOW IT MUSIC DOWNLOAD,1,99,7.48827E+13,0:19:41,0,10
5,1,3,1.29,1,0,4.04667E+18,1.29,97794250,28659,1,48,20120428,amazon.com,MR. KNOW IT ALL (COUNTRY VERSION) MUSIC DOWNLOAD,1,99,7.62515E+13,9:27:43,0,10
5,1,3,1.29,1,0,4.04667E+18,1.29,97794250,28659,1,48,20120304,amazon.com,GOOD GIRL MUSIC DOWNLOAD,1,99,7.72464E+13,16:11:12,0,10
5,1,3,0.99,1,0,4.04667E+18,0.99,97794250,28659,1,48,20120319,amazon.com,BANJO MUSIC DOWNLOAD,1,99,7.76777E+13,0:10:19,0,10
5,1,3,9.99,1,0,4.04667E+18,9.99,97794250,28659,1,48,20120501,amazon.com,BLOWN AWAY MUSIC DOWNLOAD,1,99,7.8491E+13,9:12:27,0,10
5,1,3,0.99,1,0,4.04667E+18,0.99,97794250,28659,1,48,20120501,amazon.com,GEORGIA PEACHES MUSIC DOWNLOAD,1,99,7.8491E+13,9:12:27,0,10
5,1,3,0.99,1,0,4.04667E+18,0.99,97794250,28659,1,48,20120501,amazon.com,WHY YA WANNA MUSIC DOWNLOAD,1,99,7.8491E+13,9:12:27,0,10
5,1,3,0.99,1,0,4.04667E+18,0.99,97794250,28659,1,48,20120426,amazon.com,NO REINS MUSIC DOWNLOAD,1,99,7.90487E+13,9:26:15,0,10
5,1,3,0.99,1,0,4.04667E+18,0.99,97794250,28659,1,48,20120426,amazon.com,EVERY DAY MUSIC DOWNLOAD,1,99,7.90487E+13,9:26:15,0,10
5,1,3,0.99,1,0,4.04667E+18,0.99,97794250,28659,1,48,20120426,amazon.com,OKLAHOMA-TEXAS LINE MUSIC DOWNLOAD,1,99,7.90487E+13,9:26:15,0,10
5,1,3,0.99,1,0,4.04667E+18,0.99,97794250,28659,1,48,20120406,amazon.com,FRIDAY MUSIC DOWNLOAD,1,99,7.9362E+13,9:07:23,0,10
5,1,3,5,1,0,4.04667E+18,5,97794250,28659,1,48,20120403,amazon.com,THE BEST OF RASCAL FLATTS LIVE MUSIC DOWNLOAD,1,99,7.99421E+13,21:47:14,0,10
5,1,3,0.99,1,0,4.04667E+18,0.99,97794250,28659,1,48,20120404,amazon.com,WHERE YOU ARE MUSIC DOWNLOAD,1,99,8.00661E+13,21:14:10,0,10
5,1,3,0.99,1,0,4.04667E+18,0.99,97794250,28659,1,48,20120404,amazon.com,ME AND MY GANG MUSIC DOWNLOAD,1,99,8.00661E+13,21:14:10,0,10
5,1,3,0.99,1,0,4.04667E+18,0.99,97794250,28659,1,48,20120404,amazon.com,I FEEL BAD MUSIC DOWNLOAD,1,99,8.00661E+13,21:14:10,0,10
5,4,3,2.99,1,1,4.04667E+18,2.99,97795098,40517,1,48,20120525,amazon.com,SCARS ON 45 MUSIC DOWNLOAD,1,99,7.69854E+13,0:06:12,0,10
1,5,3,8.99,1,1,4.04667E+18,8.99,97798354,71103,1,48,20120721,amazon.com,ROYALTY FREE MUSIC MUSIC DOWNLOAD,5,99,1.00289E+14,11:26:04,0,10
1,5,3,0.99,1,1,4.04667E+18,5.47,97798354,71103,1,48,20121017,amazon.com,AIN'T NO STOPPIN' US NOW MCFADDEN & WHITEHEAD MP3 DOWNLOADS N/A,5,99,4.92159E+11,15:01:01,0,10
1,5,3,0.99,1,1,4.04667E+18,0.99,97798354,71103,1,48,20120505,amazon.com,AUTUMN LEAVES MUSIC DOWNLOAD,5,99,7.71629E+13,16:09:06,0,10
1,5,3,0.99,1,1,4.04667E+18,0.99,97798354,71103,1,48,20120401,amazon.com,MORE THAN YOU KNOW MUSIC DOWNLOAD,5,99,7.80381E+13,15:35:08,0,10
1,5,3,7.99,1,1,4.04667E+18,7.99,97798354,71103,1,48,20120623,amazon.com,CARS ORIGINAL SOUNDTRACK MUSIC DOWNLOAD,5,99,9.25341E+13,17:25:14,0,10
6,3,1,0.89,1,1,4.04667E+18,0.89,97799213,16838,1,48,20120719,amazon.com,SUITE NO. 5: THE HARMONIOUS BLACKSMITH MUSIC DOWNLOAD,1,99,1.09985E+14,1:05:34,0,10
6,3,1,0.89,1,1,4.04667E+18,5.37,97799213,16838,1,48,20121005,amazon.com,BACKFIELD IN MOTION VAL MERRALL MP3 DOWNLOADS N/A,1,99,4.93354E+11,21:40:47,0,10
6,3,1,0.99,1,1,4.04667E+18,5.47,97799213,16838,1,48,20121005,amazon.com,SOULSVILLE ISAAC HAYES MP3 DOWNLOADS N/A,1,99,4.93365E+11,17:31:47,0,10
6,3,1,0.99,1,1,4.04667E+18,5.47,97799213,16838,1,48,20121005,amazon.com,PASSION DANCE MCCOY TYNER MP3 DOWNLOADS N/A,1,99,4.93372E+11,10:46:10,0,10
6,3,1,0.99,1,1,4.04667E+18,5.47,97799213,16838,1,48,20121005,amazon.com,CONTEMPLATION MCCOY TYNER MP3 DOWNLOADS N/A,1,99,4.93374E+11,8:48:26,0,10
6,3,1,0.99,1,1,4.04667E+18,5.47,97799213,16838,1,48,20120930,amazon.com,AVE MARIA CARPENTERS MP3 DOWNLOADS N/A,1,99,5.14205E+11,21:22:15,0,10
6,3,1,0.99,1,1,4.04667E+18,5.47,97799213,16838,1,48,20120930,amazon.com,GOOFUS CARPENTERS MP3 DOWNLOADS N/A,1,99,5.14222E+11,19:05:09,0,10
6,3,1,0.99,1,1,4.04667E+18,5.47,97799213,16838,1,48,20121009,amazon.com,FIELDS OF GOLD STING MP3 DOWNLOADS N/A,1,99,5.14916E+11,5:44:27,0,10
6,3,1,0.99,1,1,4.04667E+18,5.47,97799213,16838,1,48,20120920,amazon.com,TUPELO HONEY PICKIN' ON SERIES MP3 DOWNLOADS N/A,1,99,5.32659E+11,10:51:41,0,10
6,3,1,0.89,1,1,4.04667E+18,5.37,97799213,16838,1,48,20120925,amazon.com,GOOD FEELING (THAT I NEVER HAD BEFORE) FAVORITE SONG MP3 DOWNLOADS N/A,1,99,5.4361E+11,12:54:56,0,10
6,3,1,0.99,1,1,4.04667E+18,5.47,97799213,16838,1,48,20120925,amazon.com,FEELING GOOD (ALBUM VERSION) JR. SAMMY DAVIS MP3 DOWNLOADS N/A,1,99,5.4361E+11,12:54:56,0,10
6,3,1,0.99,1,1,4.04667E+18,0.99,97799213,16838,1,48,20120126,amazon.com,THE BEST SIDE OF GOODBYE MUSIC DOWNLOAD,1,99,7.48047E+13,22:59:05,0,10
6,3,1,0.99,1,1,4.04667E+18,0.99,97799213,16838,1,48,20120603,amazon.com,SHOW AND TELL (ALBUM VERSION) MUSIC DOWNLOAD,1,99,9.66678E+13,1:02:19,0,10
7,2,1,0.99,1,1,4.04667E+18,0.99,97924369,19107,1,48,20120122,amazon.com,BESAME MUCHO MUSIC DOWNLOAD,1,99,7.34875E+13,15:06:29,0,4
7,2,1,0.99,1,1,4.04667E+18,0.99,97924369,19107,1,48,20120122,amazon.com,CON TE PARTIRO MUSIC DOWNLOAD,1,99,7.34875E+13,15:06:29,0,4
7,2,1,0.99,1,1,4.04667E+18,0.99,97924369,19107,1,48,20120122,amazon.com,LA VOCE DEL SILENZIO MUSIC DOWNLOAD,1,99,7.34875E+13,15:06:29,0,4
7,2,1,0.99,1,1,4.04667E+18,0.99,97924369,19107,1,48,20120122,amazon.com,CARUSO MUSIC DOWNLOAD,1,99,7.34875E+13,15:06:29,0,4
7,2,1,0.99,1,1,4.04667E+18,0.99,97924369,19107,1,48,20120122,amazon.com,SOMOS NOVIOS (IT'S IMPOSSIBLE) MUSIC DOWNLOAD,1,99,7.34875E+13,15:06:29,0,4
7,2,1,0.99,1,1,4.04667E+18,0.99,97924369,19107,1,48,20120122,amazon.com,EL MAR Y TU MUSIC DOWNLOAD,1,99,7.34875E+13,15:06:29,0,4
7,2,1,0.99,1,1,4.04667E+18,0.99,97924369,19107,1,48,20120122,amazon.com,SOLAMENTE UNA VEZ MUSIC DOWNLOAD,1,99,7.34875E+13,15:06:29,0,4
7,2,1,0.99,1,1,4.04667E+18,0.99,97924369,19107,1,48,20120122,amazon.com,MOMENTOS MUSIC DOWNLOAD,1,99,7.34875E+13,15:06:29,0,4
7,2,1,0.99,1,1,4.04667E+18,0.99,97924369,19107,1,48,20120122,amazon.com,PER AMORE MUSIC DOWNLOAD,1,99,7.34875E+13,15:06:29,0,4
7,2,1,0.99,1,1,4.04667E+18,0.99,97924369,19107,1,48,20120122,amazon.com,NUESTRO ENCUENTRO (SENTADO A 'BEIRA DO CAMINHO) MUSIC DOWNLOAD,1,99,7.34875E+13,15:06:29,0,4
7,2,1,0.99,1,1,4.04667E+18,0.99,97924369,19107,1,48,20120122,amazon.com,EN ARANJUEZ CON TU AMOR - CONCIERTO DE ARANJUEZ MUSIC DOWNLOAD,1,99,7.34875E+13,15:06:29,0,4
7,2,1,0.99,1,1,4.04667E+18,0.99,97924369,19107,1,48,20120122,amazon.com,LE TUE PAROLE MUSIC DOWNLOAD,1,99,7.34875E+13,15:06:29,0,4
7,2,1,0.99,1,1,4.04667E+18,0.99,97924369,19107,1,48,20120122,amazon.com,L'APPUNTAMENTO (SENTADO A 'BEIRA DO CAMINHO) MUSIC DOWNLOAD,1,99,7.34875E+13,15:06:29,0,4
6,4,1,0.99,1,1,4.04667E+18,0.99,97928160,14425,1,48,20120331,amazon.com,I LOVE YOU THIS BIG MUSIC DOWNLOAD,1,99,7.60294E+13,18:05:31,0,5
6,4,1,0.99,1,1,4.04667E+18,0.99,97928160,14425,1,48,20120331,amazon.com,CLEAR AS DAY MUSIC DOWNLOAD,1,99,7.60294E+13,18:05:31,0,5
6,4,1,0.99,1,1,4.04667E+18,0.99,97928160,14425,1,48,20120331,amazon.com,THE TROUBLE WITH GIRLS MUSIC DOWNLOAD,1,99,7.60294E+13,18:05:31,0,5
6,4,1,0.99,1,1,4.04667E+18,0.99,97928160,14425,1,48,20120331,amazon.com,PLEASE REMEMBER ME MUSIC DOWNLOAD,1,99,7.60294E+13,18:05:31,0,5
6,4,1,0.99,1,1,4.04667E+18,0.99,97928160,14425,1,48,20120331,amazon.com,I LOVE YOU THIS BIG MUSIC DOWNLOAD,1,99,7.60294E+13,18:05:31,0,5
6,4,1,0.99,1,1,4.04667E+18,0.99,97928160,14425,1,48,20120331,amazon.com,SMILE MUSIC DOWNLOAD,1,99,7.60294E+13,18:05:31,0,5
6,4,1,0.99,1,1,4.04667E+18,0.99,97928160,14425,1,48,20120331,amazon.com,SEXY AND I KNOW IT MUSIC DOWNLOAD,1,99,7.60294E+13,17:11:54,0,5
6,4,1,1.29,1,1,4.04667E+18,1.29,97928160,14425,1,48,20120331,amazon.com,"VALENTINE (WITH SPECIAL GUEST ARTIST, JIM BRICKMAN) MUSIC DOWNLOAD",1,99,7.60294E+13,17:11:54,0,5
6,4,1,0.99,1,1,4.04667E+18,0.99,97928160,14425,1,48,20120331,amazon.com,LOST IN THIS MOMENT MUSIC DOWNLOAD,1,99,7.60294E+13,17:11:54,0,5
6,4,1,0.99,1,1,4.04667E+18,0.99,97928160,14425,1,48,20120331,amazon.com,MY BEST FRIEND MUSIC DOWNLOAD,1,99,7.60294E+13,17:11:54,0,5
6,4,1,0.99,1,1,4.04667E+18,0.99,97928160,14425,1,48,20120331,amazon.com,"CHEATER, CHEATER MUSIC DOWNLOAD",1,99,7.60294E+13,17:11:54,0,5
6,4,1,0.99,1,1,4.04667E+18,0.99,97928160,14425,1,48,20120331,amazon.com,U CAN'T TOUCH THIS MUSIC DOWNLOAD,1,99,7.60294E+13,17:11:54,0,5
6,4,1,0.99,1,1,4.04667E+18,0.99,97928160,14425,1,48,20120405,amazon.com,I LOVE YOU THIS BIG MUSIC DOWNLOAD,1,99,8.09515E+13,2:40:13,0,5
6,4,1,0.99,1,1,4.04667E+18,0.99,97928160,14425,1,48,20120405,amazon.com,IT'S YOUR LOVE (WITH FAITH HILL) MUSIC DOWNLOAD,1,99,8.09515E+13,2:40:13,0,5
6,4,1,1.29,1,1,4.04667E+18,1.29,97928160,14425,1,48,20120617,amazon.com,THAT'S WHAT FRIENDS ARE FOR (DIGITALLY REMASTERED: 1999) MUSIC DOWNLOAD,1,99,9.56515E+13,3:25:36,0,5
6,4,1,0.99,1,1,4.04667E+18,0.99,97928160,14425,1,48,20120616,amazon.com,THAT'S WHAT FRIENDS ARE FOR MUSIC DOWNLOAD,1,99,9.57515E+13,3:15:51,0,5
6,4,1,0.99,1,1,4.04667E+18,0.99,97928160,14425,1,48,20120616,amazon.com,WHAT DREAMS ARE MADE OF MUSIC DOWNLOAD,1,99,9.57515E+13,3:15:51,0,5
6,4,1,0.99,1,1,4.04667E+18,0.99,97928160,14425,1,48,20120616,amazon.com,GOOD RIDDANCE [TIME OF YOUR LIFE] (ALBUM VERSION) MUSIC DOWNLOAD,1,99,9.57515E+13,0:52:59,0,5
6,4,1,0.99,1,1,4.04667E+18,0.99,97928160,14425,1,48,20120616,amazon.com,PLEASE REMEMBER ME MUSIC DOWNLOAD,1,99,9.57515E+13,0:52:59,0,5
1,1,2,0.99,1,0,4.04667E+18,0.99,97929800,60640,1,48,20120713,amazon.com,I AIN'T GOT NOTHING BUT THE BLUES MUSIC DOWNLOAD,1,99,1.06369E+14,6:22:50,0,4
1,1,2,0.89,1,0,4.04667E+18,0.89,97929800,60640,1,48,20120713,amazon.com,A HOUSE IS NOT A HOME MUSIC DOWNLOAD,1,99,1.06369E+14,4:45:23,0,4
1,1,2,0.89,1,0,4.04667E+18,0.89,97929800,60640,1,48,20120713,amazon.com,FOLKS WHO LIVE ON THE HILL MUSIC DOWNLOAD,1,99,1.06369E+14,4:45:23,0,4
1,1,2,7.99,1,0,4.04667E+18,7.99,97929800,60640,1,48,20120713,amazon.com,FEELIN' GOOD MUSIC DOWNLOAD,1,99,1.06369E+14,4:45:23,0,4
3,1,3,31.45,1,0,4.04667E+18,37.03,97974871,33602,1,48,20121109,amazon.com,"EKTELON POWER PACK PLUS STARTER KIT, GRIP 3 5/8 N/A",1,99,4.24954E+11,14:41:17,1,3
4,2,3,0.89,1,0,4.04667E+18,5.37,98026605,75067,1,48,20120824,amazon.com,CANTINA RUSHED ELMER BERNSTEIN MP3 DOWNLOADS N/A,1,99,1.10466E+14,23:14:18,0,10
4,2,3,0.99,1,0,4.04667E+18,5.47,98026605,75067,1,48,20120901,amazon.com,FREEDA ON THE FREEWAY HOMER AND JETHRO MP3 DOWNLOADS N/A,1,99,5.16824E+11,0:24:25,0,10
5,1,4,8.99,1,0,4.04667E+18,8.99,98131327,92203,1,48,20120705,amazon.com,WATERFALL CITIES MUSIC DOWNLOAD,1,99,1.0332E+14,0:19:28,0,10
5,1,4,8.99,1,0,4.04667E+18,8.99,98131327,92203,1,48,20120705,amazon.com,EVERYBODY WANT SUM MUSIC DOWNLOAD,1,99,1.0332E+14,0:19:28,0,10
5,1,4,4.95,1,0,4.04667E+18,4.95,98131327,92203,1,48,20120705,amazon.com,LISTEN HEAR MUSIC DOWNLOAD,1,99,1.0332E+14,0:19:28,0,10
7,1,1,0.25,1,0,4.04667E+18,0.25,98132256,12306,1,48,20120723,amazon.com,TOO CLOSE MUSIC DOWNLOAD,2,99,1.09882E+14,5:12:32,1,8
7,1,1,0.99,1,0,4.04667E+18,0.99,98132256,12306,1,48,20120723,amazon.com,BAD GIRLS MUSIC DOWNLOAD,2,99,1.09882E+14,3:18:14,1,8
6,5,3,0.99,1,1,4.04667E+18,0.99,98186296,29045,1,48,20120723,amazon.com,UNBROKEN MUSIC DOWNLOAD,2,99,1.09904E+14,0:21:13,0,7
3,1,3,6.99,1,0,4.04667E+18,6.99,98321966,30909,1,48,20120112,amazon.com,MOONLIGHT IN VERMONT MUSIC DOWNLOAD,1,99,7.49238E+13,16:42:40,0,7
5,2,1,52.19,1,1,4.04667E+18,59.18,98368406,12586,1,48,20120117,amazon.com,MODERN SCHOOL BUSINESS ADMINISTRATION A PLANNING APPROACH (PEABODY COLLEGE EDUCATION LEADERSHIP SERIES) N/A,2,99,7.56775E+13,0:45:00,0,7
7,4,4,1.29,1,1,4.04667E+18,1.29,98522536,80111,1,48,20120602,amazon.com,HEARTS ON FIRE MUSIC DOWNLOAD,1,99,9.54001E+13,18:12:26,0,5
5,2,3,0.99,1,1,4.04667E+18,0.99,98533251,32129,1,48,20120216,amazon.com,BEEKEEPER'S DAUGHTER MUSIC DOWNLOAD,1,99,7.61133E+13,20:06:59,0,5
7,3,3,7.99,1,1,4.04667E+18,7.99,98625333,20187,1,48,20120409,amazon.com,NOW THAT'S WHAT I CALL CLASSIC ROCK MUSIC DOWNLOAD,1,99,8.11461E+13,16:44:07,0,8
7,3,3,1.29,1,1,4.04667E+18,1.29,98625333,20187,1,48,20120409,amazon.com,KICKSTART MY HEART MUSIC DOWNLOAD,1,99,8.11461E+13,16:44:07,0,8
7,3,3,0.99,1,1,4.04667E+18,0.99,98625333,20187,1,48,20120409,amazon.com,JUMP MUSIC DOWNLOAD,1,99,8.11461E+13,16:44:07,0,8
7,3,3,0.99,1,1,4.04667E+18,0.99,98625333,20187,1,48,20120409,amazon.com,IF YOU WERE THE ONLY GIRL IN THE WORLD MUSIC DOWNLOAD,1,99,8.11462E+13,4:37:39,0,8
2,4,4,9.49,1,1,4.04667E+18,9.49,98701212,98027,1,48,20120705,amazon.com,RHYTHMS DEL MUNDO CUBA MUSIC DOWNLOAD,5,99,1.03353E+14,5:51:02,0,7
3,3,2,0.99,1,1,4.04667E+18,5.47,98710716,45403,1,48,20120811,amazon.com,REVEILLE US MARINE BAND MP3 DOWNLOADS N/A,1,99,1.02789E+14,21:10:32,0,10
3,3,2,0.99,1,1,4.04667E+18,5.47,98710716,45403,1,48,20120811,amazon.com,THE MEAN KITTY SONG (HEY LITTLE SPARTA) MM REMIX MP3 DOWNLOADS N/A,1,99,1.02789E+14,21:10:32,0,10
3,3,2,0.99,1,1,4.04667E+18,5.47,98710716,45403,1,48,20120811,amazon.com,JUKE BOX HERO (KARAOKE VERSION) STINGRAY MUSIC (KARAOKE) MP3 DOWNLOADS N/A,1,99,1.02789E+14,21:10:32,0,10
7,1,4,8.99,1,0,4.04667E+18,8.99,98749882,91206,1,48,20120620,amazon.com,LISTEN TO MY SONG: THE MUSIC CITY SESSIONS MUSIC DOWNLOAD,1,99,1.02104E+14,22:08:53,0,4
7,1,4,0.99,1,0,4.04667E+18,5.47,98749882,91206,1,48,20121001,amazon.com,STARSHIPS [EXPLICIT] NICKI MINAJ MP3 DOWNLOADS N/A,1,99,5.6072E+11,2:57:33,0,4
7,1,4,1.29,1,0,4.04667E+18,5.77,98749882,91206,1,48,20121001,amazon.com,BROKENHEARTED KARMIN MP3 DOWNLOADS N/A,1,99,5.6072E+11,2:57:33,0,4
7,1,4,5.99,1,0,4.04667E+18,5.99,98749882,91206,1,48,20120313,amazon.com,MY SOUL TO KEEP [EXPLICIT] MUSIC DOWNLOAD,1,99,7.82104E+13,7:41:47,0,4
3,2,4,1.19,1,1,4.04667E+18,1.19,98767049,98032,1,48,20120626,amazon.com,DEFEATING BIZARRO MUSIC DOWNLOAD,1,99,1.02506E+14,22:47:16,0,8
3,2,4,0.99,1,1,4.04667E+18,5.47,98767049,98032,1,48,20121010,amazon.com,NO EASY WAY OUT (2006 DIGITAL REMASTER) ROBERT TEPPER MP3 DOWNLOADS N/A,1,99,5.58152E+11,17:24:56,0,8
3,2,4,0.99,1,1,4.04667E+18,5.47,98767049,98032,1,48,20121010,amazon.com,HEART'S ON FIRE (2006 DIGITAL REMASTER) JOHN CAFFERTY MP3 DOWNLOADS N/A,1,99,5.58152E+11,17:24:56,0,8
3,2,4,0.99,1,1,4.04667E+18,5.47,98767049,98032,1,48,20121010,amazon.com,"BURNING HEART (FROM ""ROCKY IV"") (2006 DIGITAL REMASTER) SURVIVOR MP3 DOWNLOADS N/A",1,99,5.58152E+11,17:24:56,0,8
3,2,4,0.99,1,1,4.04667E+18,5.47,98767049,98032,1,48,20121010,amazon.com,FEELS LIKE TODAY RASCAL FLATTS MP3 DOWNLOADS N/A,1,99,5.58152E+11,17:24:56,0,8
3,2,4,0.99,1,1,4.04667E+18,5.47,98767049,98032,1,48,20121010,amazon.com,INSIDE OUT (LP VERSION) VONRAY MP3 DOWNLOADS N/A,1,99,5.58152E+11,17:24:56,0,8
3,2,4,0.99,1,1,4.04667E+18,5.47,98767049,98032,1,48,20120918,amazon.com,SPIRIT DREAMS INSIDE L'ARC-EN-CIEL MP3 DOWNLOADS N/A,1,99,6.26442E+11,19:17:47,0,8
3,2,4,0.99,1,1,4.04667E+18,5.47,98767049,98032,1,48,20120918,amazon.com,DUELING GUITARS HEITOR PEREIRA;DOUG SMITH MP3 DOWNLOADS N/A,1,99,6.26442E+11,19:17:47,0,8
3,2,4,0.89,1,1,4.04667E+18,5.37,98767049,98032,1,48,20120917,amazon.com,ROAD OF THE GYPSY ADRENALIN MP3 DOWNLOADS N/A,1,99,6.55059E+11,19:29:41,0,8
3,2,4,0.99,1,1,4.04667E+18,0.99,98767049,98032,1,48,20120323,amazon.com,THOR KILLS THE DESTROYER MUSIC DOWNLOAD,1,99,7.55666E+13,20:37:13,0,8
4,3,3,24.7,1,1,4.04667E+18,60.31,98768094,23505,1,48,20121217,amazon.com,RESEARCH-BASED STRATEGIES NARROWING THE ACHIEVEMENT GAP FOR UNDER-RESOURCED STUDENTS N/A,1,99,4.55106E+11,11:09:08,0,10
1,2,3,55.47,1,1,4.04667E+18,62.46,98769058,33612,1,48,20120828,amazon.com,AMERICAN EDUCATION N/A,1,99,1.15561E+14,19:46:40,0,5
